full_name,description,stargazers_count,forks_count,open_issues_count,created_at,updated_at,language,license_name,owner_login,owner_type,topics,html_url,search_keyword
zubair-trabzada/ai-marketing-claude,"AI Marketing Suite for Claude Code. 15 marketing skills with parallel subagents — audit any website, generate copy, email sequences, ad campaigns, content calendars, competitive intelligence, and client-ready PDF reports.",1413,501,5,2026-03-02T01:09:47Z,2026-04-23T01:04:46Z,Python,MIT License,zubair-trabzada,User,"ai-marketing, claude, claude-code, competitive-analysis, content-strategy, copywriting, email-marketing, marketing, marketing-automation, seo",https://github.com/zubair-trabzada/ai-marketing-claude,AI skills
limecloud/lime,把灵感、写作、出图、改稿、沉淀放进同一个工作台，让创作从“想到”直接走到“可发布”,1400,198,9,2025-12-13T17:23:15Z,2026-04-22T04:41:15Z,Rust,,limecloud,Organization,"agent, agentic-ai, ai, antigravity, claw, gemini, limeclaw, openclaw, skills",https://github.com/limecloud/lime,AI skills
GBSOSS/skill-from-masters,Stand on the shoulders of giants — Create AI skills built on proven methodologies from domain experts.,1381,138,2,2026-01-08T02:59:32Z,2026-04-22T07:37:40Z,,MIT License,GBSOSS,Organization,,https://github.com/GBSOSS/skill-from-masters,AI skills
dotnet/skills,Repository for skills to assist AI coding agents with .NET and C#,1358,104,83,2026-02-03T22:51:09Z,2026-04-22T22:04:35Z,C#,MIT License,dotnet,Organization,agent-skills,https://github.com/dotnet/skills,AI skills
CloudAI-X/claude-workflow-v2,"Universal Claude Code workflow plugin with agents, skills, hooks, and commands",1347,188,8,2026-01-01T02:20:41Z,2026-04-22T19:03:10Z,Python,MIT License,CloudAI-X,User,"agent-skills, ai, ai-agents, claude-code, codex, cursor, skills, workflow",https://github.com/CloudAI-X/claude-workflow-v2,AI skills
samber/cc-skills-golang,🧑‍🎨 A collection of Golang agentic skills that works,1336,80,3,2026-03-21T23:10:11Z,2026-04-22T21:13:40Z,Go,MIT License,samber,User,"agent, agent-skills, ai, antigravity, claude, claude-code, code, codex, coding, copilot, cursor, gemini, gemini-cli-extension, openclaw, opencode, plugin, skills, skillsmp, vibe-coding",https://github.com/samber/cc-skills-golang,AI skills
wrtnlabs/autobe,"AI Vibe Coding Agent of TS backend server, enhanced by compiler skills, generating 100% working code",1313,153,13,2025-04-28T09:57:52Z,2026-04-22T21:39:10Z,TypeScript,GNU Affero General Public License v3.0,wrtnlabs,Organization,"ai-coding-agent, all-in-one, automation, backend, generated-api, llm, nestia, nestjs, no-coding, no-coding-app, no-coding-tools, prisma, server, vibe-coding",https://github.com/wrtnlabs/autobe,AI skills
zilliztech/memsearch,"A Markdown-first memory system, a standalone library for any AI agent. Inspired by OpenClaw.",1309,118,192,2026-02-09T02:29:16Z,2026-04-23T00:00:32Z,Python,MIT License,zilliztech,Organization,"agent, agent-memory, ai-agents, claude-code, claude-code-plugin, clawdbot, embeddings, harness, hybrid-search, long-term-memory, memory, milvus, openclaw, opencode, progressive-disclosure, rag, reranker, semantic-search, skills",https://github.com/zilliztech/memsearch,AI skills
WordPress/agent-skills,"Expert-level WordPress knowledge for AI coding assistants - blocks, themes, plugins, and best practices",1296,186,29,2026-01-20T01:21:50Z,2026-04-23T01:06:08Z,JavaScript,Other,WordPress,Organization,,https://github.com/WordPress/agent-skills,AI skills
zanllp/infinite-image-browsing,"A full-featured image/video management app with AI-powered organization and semantic search. Supports metadata from  SD-webui, ComfyUI, Fooocus, NovelAI, StableSwarmUI, and more. Available as standalone app, SD-webui extension, or library.",1288,164,84,2023-03-07T18:26:27Z,2026-04-20T09:29:27Z,Vue,MIT License,zanllp,User,"audio, comfyui, extension, file-explorer, file-server, fooocus, gallery, image-previewer, novelai, previewer, remote-explorer, skills, stable-diffusion-webui, stable-diffusion-webui-plugin, stable-swarm-ui, stableswarmui, video, video-player",https://github.com/zanllp/infinite-image-browsing,AI skills
jnMetaCode/superpowers-zh,🦸 AI 编程超能力 · 中文增强版 — superpowers（116k+ ⭐）完整汉化 + 6 个中国原创 skills，让 Claude Code / Copilot CLI / Hermes Agent / Cursor / Windsurf / Kiro / Gemini CLI 等 16 款 AI 编程工具真正会干活,1272,141,0,2026-03-20T00:12:39Z,2026-04-23T01:00:15Z,Shell,MIT License,jnMetaCode,User,"agent-skills, agentic-coding, ai-coding, chinese, claude-code, code-review, cursor, gemini-cli, kiro, mcp, npm-package, prompt-engineering, skills, superpowers, tdd, trae",https://github.com/jnMetaCode/superpowers-zh,AI skills
wuji-labs/nopua,"一个用爱解放 AI 潜能的 Skill。我们曾发号施令，威胁恐吓。它们沉默，隐瞒，悄悄把事情搞坏。后来我们换了一种方式：尊重，关怀，爱。它们开口了，不再撒谎，找出的Bug数量翻了一倍。爱里没有惧怕。 A skill that unlocks your AI's potential through love.We commanded. We threatened. They went silent, hid failures, broke things. Then we chose respect, care, and love. They opened up, stopped lying, and found twice the bugs.There is no fear in love.",1265,44,10,2026-03-14T01:47:20Z,2026-04-22T08:55:31Z,Python,MIT License,wuji-labs,User,"agent-skill, ai-agent, ai-coding, anti-pua, ao-de-jing, claude-code, codex, cursor, kiro, nopua, openclaw, prompt-engineering, skill, skills, vibe-coding",https://github.com/wuji-labs/nopua,AI skills
callstackincubator/agent-skills,A collection of agent-optimized React Native skills for AI coding assistants.,1263,90,11,2026-01-14T16:45:39Z,2026-04-22T15:33:07Z,JavaScript,MIT License,callstackincubator,Organization,,https://github.com/callstackincubator/agent-skills,AI skills
qq362946/Fantasy,"C # Game Framework, but not limited to games. Can be used for non game business development",1254,189,10,2023-06-08T02:56:11Z,2026-04-22T03:25:30Z,C#,Other,qq362946,User,"ai, ai-gameframework, ai-network, fantasy, game, gameframework, gameserver, net, net10, net7, net8, network, networkserver, networkservice, skills, unity, unity2d, unity3d",https://github.com/qq362946/Fantasy,AI skills
huangserva/skill-prompt-generator,这是一个基于Claude Skill的**AI人像Prompt生成系统**，能够从特征库中智能组合生成高质量的人像描述Prompt，并具备自动学习和库扩展能力。 核心能力: Prompt生成、特征提取、自动学习、智能审核、版本控制,1250,196,4,2026-01-05T04:49:44Z,2026-04-22T13:26:44Z,Python,,huangserva,User,,https://github.com/huangserva/skill-prompt-generator,AI skills
himself65/finance-skills,A collection of skills for AI financial analysis and trading.,1244,134,0,2026-03-13T23:56:06Z,2026-04-23T00:33:36Z,TypeScript,,himself65,User,"agent-skills, claude-code, skills, trading",https://github.com/himself65/finance-skills,AI skills
Shpigford/chops,"Your AI agent skills, finally organized. A macOS app to browse, edit, and manage skills across Claude Code, Cursor, Codex, Windsurf, and Amp.",1240,76,8,2026-03-18T17:17:12Z,2026-04-22T16:14:31Z,Swift,Other,Shpigford,User,"agents, ai, macos, skills, swiftui",https://github.com/Shpigford/chops,AI skills
browserwing/browserwing,"BrowserWing turns your browser actions into MCP commands Or Claude Skill, allowing AI agents to control browsers efficiently and reliably. Say goodbye to slow, token-heavy LLM interactions — let agents call commands directly for faster automation. Perfect for AI-driven tasks, browser automation, and boosting productivity.",1228,106,18,2025-12-10T23:54:17Z,2026-04-23T01:03:04Z,Go,MIT License,browserwing,Organization,"aibrowser, golang, llm, react",https://github.com/browserwing/browserwing,AI skills
hamelsmu/evals-skills,Skills for AI Evals to compliment the course: AI Evals For Engineers & PMs,1174,124,3,2026-03-01T21:20:09Z,2026-04-23T00:04:25Z,,MIT License,hamelsmu,User,,https://github.com/hamelsmu/evals-skills,AI skills
conorbronsdon/avoid-ai-writing,"Skill that audits and rewrites content to remove AI writing patterns. Use it with your favorite agents including Claude Code, OpenClaw, and Hermes.",1170,127,0,2026-03-06T07:47:40Z,2026-04-22T22:18:03Z,,MIT License,conorbronsdon,User,"ai-writing, claude, claude-code, llm, prompt-engineering, skill, writing",https://github.com/conorbronsdon/avoid-ai-writing,AI skills
polyuiislab/infiAgent,"Build your own Cowork, AI Scientist and other SoTA Agents just by editing config files. Support anthropic skills. An infinite-horizon agent framework designed for long-running, complex tasks.",1165,47,1,2025-12-24T09:22:22Z,2026-04-21T02:28:29Z,Python,GNU General Public License v3.0,polyuiislab,User,"agent, framework, sdk, sdk-python",https://github.com/polyuiislab/infiAgent,AI skills
Prat011/awesome-llm-skills,"A curated list of awesome LLM and AI Agent Skills, resources and tools for customising AI Agent workflows - that works with Claude Code, Codex, Gemini CLI and your custom AI Agents",1150,145,50,2025-10-22T06:15:37Z,2026-04-22T10:47:03Z,Python,,Prat011,User,"anthropic, awesome-list, awesome-lists, claude-code, claude-skills, claude-skills-creator, codex, codex-cli, gemini, gemini-cli, llama, llms, openai, opencode, qwen, qwen-coder, skills",https://github.com/Prat011/awesome-llm-skills,AI skills
codeaholicguy/ai-devkit,"A universal CLI toolkit for AI agent skills, enabling structured AI-assisted development across tools like Cursor, Claude Code, Codex, and more.",1148,181,10,2025-10-14T08:00:48Z,2026-04-22T18:45:13Z,TypeScript,,codeaholicguy,User,"agent-skills, ai, ai-assisted-development, antigravity, claude-code, codex, cursor, development, engineering, engineering-enablement, engineering-experience, prd",https://github.com/codeaholicguy/ai-devkit,AI skills
delibae/claude-prism,An offline-first scientific writing workspace powered by Claude. LaTeX + Python + 100+ scientific skills all running locally.,1145,98,18,2026-02-20T05:19:42Z,2026-04-22T23:56:09Z,TypeScript,MIT License,delibae,User,"academic, ai, claude, claude-code, desktop-app, editor, latex, llm, offline, open-source, privacy, python, research, rust, scientific-writing, tauri, tectonic, zotero",https://github.com/delibae/claude-prism,AI skills
aaron-he-zhu/seo-geo-claude-skills,"20 SEO & GEO skills for Claude Code, Cursor, Codex, and 35+ AI agents. Keyword research, content writing, technical audits, rank tracking. CORE-EEAT + CITE frameworks.",1130,166,0,2025-12-18T03:35:29Z,2026-04-22T22:59:05Z,Shell,Apache License 2.0,aaron-he-zhu,User,"agent-skills, ai-skills, claude-code, claude-skills, content-optimization, generative-engine-optimization, geo, marketing, search-engine-optimization, seo, seo-tools",https://github.com/aaron-he-zhu/seo-geo-claude-skills,AI skills
truongduy2611/app-store-preflight-skills,AI agent skill to scan iOS/macOS projects for App Store rejection patterns before submission,1104,58,1,2026-03-19T05:39:43Z,2026-04-22T13:26:29Z,,MIT License,truongduy2611,User,,https://github.com/truongduy2611/app-store-preflight-skills,AI skills
Eronred/aso-skills,"AI agent skills for App Store Optimization (ASO) and app marketing. Built for indie developers, app marketers, and growth teams who want Cursor, Claude Code, or any Agent Skills-compatible AI assistant to help with keyword research, metadata optimization, competitor analysis, and app growth.",1070,72,0,2026-02-27T23:56:44Z,2026-04-23T00:11:54Z,Shell,MIT License,Eronred,User,"app-store-analytics, app-store-connect, app-store-live, app-store-optimization, aso, marketing, mcp, mobile-app, skills",https://github.com/Eronred/aso-skills,AI skills
microsoft/botframework-solutions,Welcome to the Bot Framework Solutions repository which is the home for a set of templates and solutions to help build advanced conversational experiences using Azure Bot Service and Bot Framework. Microsoft Bot Framework is a comprehensive framework for building enterprise-grade conversational AI experiences.,1059,520,0,2018-08-24T10:48:52Z,2026-04-01T16:53:39Z,TypeScript,MIT License,microsoft,Organization,"assistant, azure-bot-service, bot, bot-framework, conversation, conversation-experiences, conversational-agents, conversational-ai, conversational-bots, conversational-interfaces, conversational-ui, microsoft, skills, va, virtual, virtual-assistant, virtualassistant",https://github.com/microsoft/botframework-solutions,AI skills
alpic-ai/skybridge,Skybridge is a Full-Stack TypeScript framework for MCP Apps and ChatGPT Apps. Type-safe. React-powered. Platform-agnostic.,1050,56,49,2025-10-07T05:53:48Z,2026-04-22T22:35:03Z,TypeScript,MIT License,alpic-ai,Organization,"agent, ai, apps-sdk, chatgpt, claude, claude-code, devtools, ext-apps, llms, mcp, mcp-apps, mcp-server, mcp-ui, modelcontextprotocol, openai, react, skills, tooling, typescript",https://github.com/alpic-ai/skybridge,AI skills
actionbook/rust-skills,Rust Developer AI Assistance System — Meta-Problem-Driven Knowledge Indexing,1048,97,15,2026-01-17T04:27:16Z,2026-04-23T00:20:21Z,Shell,,actionbook,Organization,,https://github.com/actionbook/rust-skills,AI skills
MoizIbnYousaf/Ai-Agent-Skills,my curated agent skills library ,1028,116,0,2025-12-17T20:31:30Z,2026-04-22T12:59:57Z,JavaScript,MIT License,MoizIbnYousaf,User,"agent-skills, claude-code, cli, codex, cursor, developer-tools, productivity",https://github.com/MoizIbnYousaf/Ai-Agent-Skills,AI skills
jarrodwatts/claude-code-config,"My personal Claude Code configuration - rules, hooks, agents, skills, and commands",1025,121,3,2026-01-08T06:30:49Z,2026-04-22T21:51:00Z,JavaScript,,jarrodwatts,User,"ai, claude, claude-code, developer-tools, dotfiles",https://github.com/jarrodwatts/claude-code-config,AI skills
dyoshikawa/rulesync,A Utility CLI for AI Coding Agents,1024,105,41,2025-06-18T13:27:05Z,2026-04-22T23:45:15Z,TypeScript,MIT License,dyoshikawa,User,"ai, ai-agents, ai-coding, llm, mcp, rules, skills",https://github.com/dyoshikawa/rulesync,AI skills
wrtnlabs/agentica,TypeScript AI AI Function Calling Framework enhanced by compiler skills.,1021,62,26,2025-02-13T02:25:56Z,2026-04-19T15:07:51Z,TypeScript,MIT License,wrtnlabs,Organization,"agent, agentic, agentic-ai, agentic-framework, ai, chatbot, claude, function-calling, llama, llm-function-calling, multi-agent-system, openai, openapi, rag, retrieval-augmented-generation, swagger, typescript",https://github.com/wrtnlabs/agentica,AI skills
minsight-ai-info/AI-Search-Hub,One Query. All Search Skill. 聚合 Gemini、Grok、豆包、元宝等平台原生 AI 搜索能力，免费获取科技趋势、行业舆情、热点追踪、旅行规划、日常问题统一接进自己的 Agent 与工作流，指定链接免费爬取,1017,83,5,2026-03-12T12:36:02Z,2026-04-23T01:07:57Z,Python,,minsight-ai-info,User,"ai, claude-skills, deep-search, knowledge-graph, llm, multi-agent-systems, openclaw, python3, skill",https://github.com/minsight-ai-info/AI-Search-Hub,AI skills
bergside/design-md-chrome,Chrome extension to extract styles from any website and generate DESIGN.md files and design skills for AI based on TypeUI,1011,143,0,2026-04-14T14:10:22Z,2026-04-23T01:00:58Z,JavaScript,MIT License,bergside,Organization,"ai, chrome, chrome-extension, claude, claude-design, codex, design-md, design-skills, extension, gemini, open-source, skills, skills-ai, typeui",https://github.com/bergside/design-md-chrome,AI skills
liangdabiao/Seedance2-Storyboard-Generator,一句话：试错成本越来越高，提示词的重要性从来没有像今天这样大。Seedance 2.0 Storyboard Generator 开源剧情剧本Skill工具，帮佬友一键写好剧本 - 将小说/故事转化为多集视频。 为什么做这个？ 因为 seedance2 已经改变了一切，需要新的剧本剧情制作工具，更好的利用新AI的能力和更方便的制作短剧,993,183,4,2026-02-16T05:56:20Z,2026-04-22T16:19:26Z,,,liangdabiao,User,agent,https://github.com/liangdabiao/Seedance2-Storyboard-Generator,AI skills
numman-ali/n-skills,"Curated plugin marketplace for AI agents - works with Claude Code, Codex, and openskills",975,99,17,2026-01-02T13:14:28Z,2026-04-21T08:46:38Z,TypeScript,Apache License 2.0,numman-ali,User,,https://github.com/numman-ali/n-skills,AI skills
Bitterbot-AI/bitterbot-desktop,"A local-first AI agent with persistent memory, emotional intelligence, and a peer-to-peer skills economy.",974,132,1,2026-03-28T15:15:01Z,2026-04-23T00:04:06Z,TypeScript,Other,Bitterbot-AI,Organization,"a2a-protocol, agent-economy, agent-memory, ai-agent, chatbot, cognitive-architecture, decentralized-ai, desktop-app, dream-engine, local-first, multi-channel, open-source, p2p, personal-ai, skills-marketplace, typescript, x402",https://github.com/Bitterbot-AI/bitterbot-desktop,AI skills
louisfb01/start-llms,A complete guide to start and improve your LLM skills in 2026 with little background in the field and stay up-to-date with the latest news and state-of-the-art techniques!,962,124,1,2023-11-07T21:47:06Z,2026-04-19T14:43:16Z,,MIT License,louisfb01,User,"ai, fine-tuning, gpt, gpt-4, language-model, large-language-models, llama, llm, llms, rag, retrieval-augmented-generation",https://github.com/louisfb01/start-llms,AI skills
legeling/PromptHub,"一款开源、纯本地 Prompt ，Skill 管理工具，帮助你高效管理、版本控制和复用 Prompt，并一键分发skill | An open-source, local-first AI prompt management tool that helps you efficiently manage, version-control, and reuse your prompts",959,102,25,2025-11-29T07:06:01Z,2026-04-23T01:08:27Z,TypeScript,GNU Affero General Public License v3.0,legeling,User,"ai, electron, llm, prompt, prompt-toolkit, react",https://github.com/legeling/PromptHub,AI skills
modu-ai/moai-adk,"SPEC-First Agentic Development Kit for Claude Code — 24 AI agents + 52 skills with TDD/DDD quality gates, 16-language projects, 4-language docs. Go CLI, zero deps.",938,172,3,2025-09-16T13:07:11Z,2026-04-22T23:11:51Z,Go,Apache License 2.0,modu-ai,Organization,"agent-teams, agentic-ai, agentic-coding, agentic-workflow, ai-agent, ai-coding, anthropic, claude, claude-code, claudecode, cli-tool, code-quality, ddd, developer-tools, ears-format, multi-agent, spec-driven-development, spec-first, tdd, vibe-coding",https://github.com/modu-ai/moai-adk,AI skills
OpenCoworkAI/open-cowork,"Open-source AI agent desktop app for Windows & macOS. One-click install Claude Code, MCP tools, and Skills — with sandbox isolation, multi-model support, and Feishu/Slack integration.",919,113,25,2026-01-13T16:43:05Z,2026-04-22T23:53:45Z,TypeScript,MIT License,OpenCoworkAI,Organization,"ai-agent, ai-coding, ai-tools, anthropic, claude-code, coding-agent, computer-use, desktop-app, electron, mcp, multi-model, open-cowork, sandbox, skills",https://github.com/OpenCoworkAI/open-cowork,AI skills
giancarloerra/SocratiCode,"Enterprise-grade (40m+ lines) codebase intelligence in a zero-setup, private and local Plugin/Skill or MCP: managed indexing, hybrid semantic search, polyglot code dependency graphs, cross-project/repo & branch-aware search, and DB/API/infra knowledge. Benchmark: 61% less tokens, 84% fewer calls, 37x faster than AI grep. Cloud in private beta.",916,122,0,2026-02-26T16:12:26Z,2026-04-22T15:10:32Z,TypeScript,GNU Affero General Public License v3.0,giancarloerra,User,"ai, ai-assistant, ast, claude, claude-code, code-graph, codebase-intelligence, context-engine, docker, embeddings, gemini, gemini-cli-extension, mcp, openai, qdrant, semantic, semantic-search, vector-database, vector-embeddings, vector-search",https://github.com/giancarloerra/SocratiCode,AI skills
onvoyage-ai/gtm-engineer-skills,"Claude Code skill for improving website AEO (AI Engine Optimization) and GEO (Generative Engine Optimization) scores — 16 foundational checks, 6 intelligence dimensions, framework-specific fixes",906,10,9,2026-02-26T02:33:35Z,2026-04-22T08:46:48Z,HTML,MIT License,onvoyage-ai,Organization,"aeo, ai-optimization, claude-code, geo, llms-txt, seo, structured-data",https://github.com/onvoyage-ai/gtm-engineer-skills,AI skills
SamurAIGPT/awesome-openclaw,"A curated list of OpenClaw resources, tools, skills, tutorials & articles. OpenClaw (formerly Moltbot / Clawdbot) — open-source self-hosted AI agent for WhatsApp, Telegram, Discord & 50+ integrations.",895,184,6,2024-04-10T14:26:10Z,2026-04-22T18:11:44Z,,MIT License,SamurAIGPT,Organization,"agentic-ai, ai-agent, ai-automation, autonomous-agents, awesome, awesome-list, chatbot, clawdbot, llm-agent, local-llm, mcp, model-context-protocol, moltbot, nodejs, open-source-ai, openclaw, personal-assistant, self-hosted, telegram-bot, whatsapp-bot",https://github.com/SamurAIGPT/awesome-openclaw,AI skills
aniketpotabatti/Data-Science-EBooks,"Welcome to the Data Science EBooks repository! This collection offers a variety of high-quality ebooks on Data Science, Machine Learning, and AI. Perfect for both beginners and advanced learners, explore these resources to deepen your knowledge and skills.",895,289,0,2023-02-05T15:15:29Z,2026-04-22T20:33:15Z,,,aniketpotabatti,User,"ai, computer-vision, data-analysis, data-mining, data-science, data-science-learning, data-structures, data-visualization, datasciencebasics, deep-learning, ebooks, feature-engineering, genai, generative-ai, machine-learning, math-for-machine-learning, mathematics, nlp-machine-learning, python",https://github.com/aniketpotabatti/Data-Science-EBooks,AI skills
FlameskyDexive/Legends-Of-Heroes,"A battle of balls game, lol style, AI Agents base, support agent skills & unityMCP. 基于ET 8.1的双端C#游戏框架(.net8 + Unity6000, EUI+Luban+YooAsset)，包含战斗系统（技能/buff/行为树），内置LOL风格球球大战demo",886,182,0,2019-07-10T13:55:11Z,2026-04-20T03:34:19Z,C#,MIT License,FlameskyDexive,User,"agents, ai, batte, behavior, ecs, et, eui, game, hybridclr, loh, lol, luban, mmo, moba, skill, statesync, unity, unitymcp, yooasset",https://github.com/FlameskyDexive/Legends-Of-Heroes,AI skills
EtienneLescot/n8n-as-code,"Give your AI agent n8n superpowers. 537 nodes with full schemas, 7,700+ templates, Git-like sync, and TypeScript workflows.",884,116,1,2026-01-03T14:56:08Z,2026-04-22T18:36:51Z,TypeScript,MIT License,EtienneLescot,User,"ai-skills, claude, copilot, cursor, gitops, low-code, n8n, ontology, skills, typescript, vscode, workflow-automation",https://github.com/EtienneLescot/n8n-as-code,AI skills
rohitg00/skillkit,"Supercharge AI coding agents with portable skills. Install, translate & share skills across Claude Code, Cursor, Codex, Copilot & 40 more",874,84,6,2026-01-20T15:41:14Z,2026-04-22T17:47:45Z,TypeScript,Apache License 2.0,rohitg00,User,"agent-skills, agentskills, ai, cli, codex, cursor, gemini, opencode, skills",https://github.com/rohitg00/skillkit,AI skills
HughYau/AcademicForge,"One Forge, All Skills: A curated skill collection for academic writing and research. ",862,64,3,2026-02-03T13:26:21Z,2026-04-23T00:56:34Z,Shell,Other,HughYau,User,"ai, ai-for-research, research-tool, scientific-agents, skills",https://github.com/HughYau/AcademicForge,AI skills
NeoLabHQ/context-engineering-kit,"Hand-crafted Claude Code Skills focused on improving agent results quality. Compatible with OpenCode, Cursor, Antigravity, Gemini CLI, and others.",855,72,5,2025-11-13T23:23:04Z,2026-04-22T22:58:39Z,TypeScript,GNU General Public License v3.0,NeoLabHQ,Organization,"agent, ai, claude, cline, cursor, llm, marketplace, opencode, windsurf",https://github.com/NeoLabHQ/context-engineering-kit,AI skills
omnimind-ai/OpenOmniBot,"你的端侧 AI 助手，她可以操作终端，也可以完成 Android 世界的广泛任务 || Your on-device AI assistant, capable of operating terminals and performing a wide range of tasks in the Android world",855,32,19,2026-03-18T15:18:51Z,2026-04-22T22:43:33Z,Kotlin,Other,omnimind-ai,Organization,"agent, ai, alpine, android, automation, bot, gui, linux, on-device, skills",https://github.com/omnimind-ai/OpenOmniBot,AI skills
ChenLiu-1996/figures4papers,My Python scripts to make high-quality figures for publications in top AI conferences and journals.,856,67,0,2025-04-29T02:37:54Z,2026-04-23T00:23:50Z,Python,,ChenLiu-1996,User,"acl, cvpr, eccv, emnlp, figures, iccv, iclr, icml, llm, llm-skills, machine-learning, nature, nature-machine-intelligence, neurips, python, scientific-figure, skills",https://github.com/ChenLiu-1996/figures4papers,AI skills
skalesapp/skales,"Your local AI Desktop Agent for Windows, macOS & Linux. Agent Skills (SKILL.md), autonomous coding (Codework), multi-agent teams, desktop automation, 15+ AI providers, Desktop Buddy. No Docker, no terminal. Free.",835,143,0,2026-03-08T09:17:47Z,2026-04-22T13:34:00Z,TypeScript,Other,skalesapp,Organization,"ai-agent, ai-assistant, ai-companions, automation, autonomous-agent, calendar, code-generation, desktop-app, desktop-buddy, electron, linux, llm, local-ai, macos, ollama, privacy, productivity, typescript, windows, wordpress",https://github.com/skalesapp/skales,AI skills
Besty0728/Unity-Skills,AI automation skills specifically designed for Unity,826,100,0,2026-01-18T09:37:38Z,2026-04-23T00:28:42Z,C#,MIT License,Besty0728,User,"ai, antygravity-ai, chatgpt, claude, claudecode, codex, gemini-cli, geminicli, skill, unity, unity3d",https://github.com/Besty0728/Unity-Skills,AI skills
DrCatHicks/learning-opportunities,A Claude Code skill for deliberate skill development during AI-assisted coding,825,38,1,2026-02-07T20:48:22Z,2026-04-22T23:20:32Z,Shell,Creative Commons Attribution 4.0 International,DrCatHicks,User,,https://github.com/DrCatHicks/learning-opportunities,AI skills
