full_name,description,stargazers_count,forks_count,open_issues_count,created_at,updated_at,language,license_name,owner_login,owner_type,topics,html_url,search_keyword
skillmatic-ai/awesome-agent-skills,The definitive resource for Agent Skills - modular capabilities revolutionizing AI agent architecture,533,87,47,2025-12-22T17:50:42Z,2026-04-22T21:08:54Z,,Creative Commons Zero v1.0 Universal,skillmatic-ai,Organization,"agent-skills, ai-agents, ai-tools, antigravity, awesome, awesome-list, claude-code, codex, context-engineering, copilot, cursor, deep-agents, gemini-cli, manus, openai, openclaw, openclaw-skills, progressive-disclosure, skills, vscode",https://github.com/skillmatic-ai/awesome-agent-skills,AI skill
obra/superpowers,An agentic skills framework & software development methodology that works.,164357,14382,317,2025-10-09T19:45:18Z,2026-04-23T01:10:32Z,Shell,MIT License,obra,User,,https://github.com/obra/superpowers,agent skills
affaan-m/everything-claude-code,"The agent harness performance optimization system. Skills, instincts, memory, security, and research-first development for Claude Code, Codex, Opencode, Cursor and beyond.",164275,25493,142,2026-01-18T00:51:51Z,2026-04-23T01:10:39Z,JavaScript,MIT License,affaan-m,User,"ai-agents, anthropic, claude, claude-code, developer-tools, llm, mcp, productivity",https://github.com/affaan-m/everything-claude-code,agent skills
anthropics/skills,Public repository for Agent Skills,122347,14266,747,2025-09-22T15:53:31Z,2026-04-23T01:09:29Z,Python,,anthropics,Organization,agent-skills,https://github.com/anthropics/skills,agent skills
hesreallyhim/awesome-claude-code,"A curated list of awesome skills, hooks, slash-commands, agent orchestrators, applications, and plugins for Claude Code by Anthropic",40350,3345,246,2025-04-19T20:55:59Z,2026-04-23T01:10:39Z,Python,Other,hesreallyhim,User,"agent-skills, agentic-code, agentic-coding, ai-workflow-optimization, ai-workflows, anthropic, anthropic-claude, awesome, awesome-claude-code, awesome-list, awesome-lists, awesome-resources, claude, claude-code, coding-agent, coding-agents, coding-assistant, coding-assistants, llm",https://github.com/hesreallyhim/awesome-claude-code,agent skills
sickn33/antigravity-awesome-skills,"Installable GitHub library of 1,400+ agentic skills for Claude Code, Cursor, Codex CLI, Gemini CLI, Antigravity, and more. Includes installer CLI, bundles, workflows, and official/community skill collections.",34620,5716,4,2026-01-14T17:48:09Z,2026-04-23T01:08:56Z,Python,MIT License,sickn33,User,"agent-skills, agentic-skills, ai-agent-skills, ai-agents, ai-coding, ai-workflows, antigravity, antigravity-skills, claude-code, claude-code-skills, codex-cli, codex-skills, cursor, cursor-skills, developer-tools, gemini-cli, gemini-skills, kiro, mcp, skill-library",https://github.com/sickn33/antigravity-awesome-skills,agent skills
kepano/obsidian-skills,"Agent skills for Obsidian. Teach your agent to use Markdown, Bases, JSON Canvas, and use the CLI.",25947,1671,32,2026-01-02T21:45:11Z,2026-04-23T01:04:02Z,,MIT License,kepano,User,"claude, clawdbot, cli, codex, defuddle, obsidian, openclaw, opencode, skills",https://github.com/kepano/obsidian-skills,agent skills
vercel-labs/agent-skills,Vercel's official collection of agent skills,25541,2315,128,2025-12-08T19:10:06Z,2026-04-23T01:03:31Z,JavaScript,,vercel-labs,Organization,,https://github.com/vercel-labs/agent-skills,agent skills
multica-ai/multica,"The open-source managed agents platform. Turn coding agents into real teammates — assign tasks, track progress, compound skills.",19454,2371,301,2026-01-13T17:59:46Z,2026-04-23T01:10:22Z,TypeScript,Other,multica-ai,Organization,,https://github.com/multica-ai/multica,agent skills
K-Dense-AI/scientific-agent-skills,"A set of ready to use Agent Skills for research, science, engineering, analysis, finance and writing.",19198,2148,33,2025-10-19T20:54:15Z,2026-04-22T23:37:51Z,Python,MIT License,K-Dense-AI,Organization,"agent-skills, ai-scientist, bioinformatics, chemoinformatics, claude, claude-skills, claudecode, clinical-research, computational-biology, data-analysis, drug-discovery, genomics, materials-science, metabolomics, proteomics, scientific-computing, scientific-visualization",https://github.com/K-Dense-AI/scientific-agent-skills,agent skills
VoltAgent/awesome-agent-skills,"A curated collection of 1000+ agent skills from official dev teams and the community, compatible with Claude Code, Codex, Gemini CLI, Cursor, and more.",17458,1881,7,2025-10-28T08:55:32Z,2026-04-23T00:53:49Z,,MIT License,VoltAgent,Organization,"agent-skills, ai-agents, antigravity-skills, awesome, awesome-list, awesome-lists, claude-code, claude-code-skills, claude-skills, codex-skills, cursor-skills, gemini-skills, opencode-skills, skills",https://github.com/VoltAgent/awesome-agent-skills,agent skills
agentskills/agentskills,Specification and documentation for Agent Skills,16902,995,42,2025-12-16T15:47:19Z,2026-04-23T01:04:31Z,Python,Apache License 2.0,agentskills,Organization,agent-skills,https://github.com/agentskills/agentskills,agent skills
vercel-labs/skills,The open agent skills tool - npx skills,15493,1272,508,2026-01-14T21:31:18Z,2026-04-23T01:07:26Z,TypeScript,,vercel-labs,Organization,,https://github.com/vercel-labs/skills,agent skills
muratcankoylan/Agent-Skills-for-Context-Engineering,"A comprehensive collection of Agent Skills for context engineering, multi-agent architectures, and production agent systems. Use when building, optimizing, or debugging agent systems that require effective context management.",15241,1192,19,2025-12-21T02:43:42Z,2026-04-23T00:13:21Z,Python,MIT License,muratcankoylan,User,,https://github.com/muratcankoylan/Agent-Skills-for-Context-Engineering,agent skills
NevaMind-AI/memU,Memory for 24/7 proactive agents like OpenClaw.,13407,1001,107,2025-07-29T01:54:40Z,2026-04-22T23:19:29Z,Python,Other,NevaMind-AI,Organization,"agent-memory, agentic-workflow, claude, claude-skills, mcp, memory, openclaw, openclaw-skills, proactive, proactive-ai, sandbox, skills",https://github.com/NevaMind-AI/memU,agent skills
alirezarezvani/claude-skills,"232+ Claude Code skills & agent plugins for Claude Code, Codex, Gemini CLI, Cursor, and 8 more coding agents — engineering, marketing, product, compliance, C-level advisory.",12355,1630,19,2025-10-19T04:04:05Z,2026-04-23T00:52:25Z,Python,MIT License,alirezarezvani,User,"agent-plugins, agent-skills, agentic-ai, ai-coding-agent, anthropic-claude, claude-ai, claude-code, claude-code-plugins, claude-code-skills, claude-skills, codex-skills, coding-agent-plugins, cursor-skills, developer-tools, gemini-cli-skills, openai-codex, openclaw, openclaw-plugins, openclaw-skills, prompt-engineering",https://github.com/alirezarezvani/claude-skills,agent skills
phuryn/pm-skills,"PM Skills Marketplace: 100+ agentic skills, commands, and plugins — from discovery to strategy, execution, launch, and growth.",10519,1215,11,2026-03-01T23:33:44Z,2026-04-22T23:54:20Z,,MIT License,phuryn,User,"agent-skill-repository, agent-skills, agentic-skills, claude-code-marketplace, claude-code-plugins, claude-cowork-plugin, product-management",https://github.com/phuryn/pm-skills,agent skills
huggingface/skills,Give your agents the power of the Hugging Face ecosystem,10272,643,28,2025-11-24T07:31:48Z,2026-04-22T21:56:53Z,Python,Apache License 2.0,huggingface,Organization,,https://github.com/huggingface/skills,agent skills
diet103/claude-code-infrastructure-showcase,"Examples of my Claude Code infrastructure with skill auto-activation, hooks, and agents",9546,1215,15,2025-10-30T03:12:16Z,2026-04-22T22:58:15Z,Shell,MIT License,diet103,User,,https://github.com/diet103/claude-code-infrastructure-showcase,agent skills
automazeio/ccpm,Project management skill system for Agents that uses GitHub Issues and Git worktrees for parallel agent execution.,8008,812,2,2025-08-18T23:20:08Z,2026-04-22T20:10:35Z,Shell,MIT License,automazeio,Organization,"ai-agents, ai-coding, claude, claude-code, project-management, vibe-coding",https://github.com/automazeio/ccpm,agent skills
nicobailon/visual-explainer,"Agent skill that generates rich HTML pages or slide decks for diagrams, diff reviews, plan audits, data tables, and project recaps",7663,521,15,2026-02-16T19:33:52Z,2026-04-22T23:36:02Z,HTML,MIT License,nicobailon,User,,https://github.com/nicobailon/visual-explainer,agent skills
refly-ai/refly,"The first open-source agent skills builder. Define skills by vibe workflow, run on Claude Code, Cursor, Codex & more. Build Clawdbot 🦞· APIs for Lovable · Bots for Slack & Lark/Feishu · Skills are infrastructure, not prompts.",7240,710,95,2024-02-19T11:04:30Z,2026-04-22T22:54:33Z,TypeScript,Other,refly-ai,Organization,"agent, agent-skills, automation, claude, clawdbot, codex, cursor, lark-bot, lovable, n8n-alternative, skills, skills-builder, slack, slack-bot, vibe-coding, vibe-workflow, workflow",https://github.com/refly-ai/refly,agent skills
wanshuiyin/Auto-claude-code-research-in-sleep,"ARIS ⚔️ (Auto-Research-In-Sleep) — Lightweight Markdown-only skills for autonomous ML research: cross-model review loops, idea discovery, and experiment automation. No framework, no lock-in — works with Claude Code, Codex, OpenClaw, or any LLM agent.",7235,680,39,2026-03-10T07:31:45Z,2026-04-23T00:51:37Z,Python,MIT License,wanshuiyin,User,"ai-research, ai-tools, aris, autonomous-agent, claude, claude-code, claude-code-skills, codex, deep-learning, gpt, idea-generation, llm, machine-learning, mcp, mcp-server, ml-research, openai, paper-review, paper-writing, research-automation",https://github.com/wanshuiyin/Auto-claude-code-research-in-sleep,agent skills
ComposioHQ/agent-orchestrator," Agentic orchestrator for parallel coding agents — plans tasks, spawns agents, and autonomously handles CI    fixes, merge conflicts, and code reviews.",6436,877,727,2026-02-13T09:52:36Z,2026-04-23T00:56:01Z,TypeScript,MIT License,ComposioHQ,Organization,"agent-fleet, agent-swarm, claude-code, codex-cli, git-worktrees, multi-agent, orchestration, orchestrator, parallel-agents, parallel-coding, skills, tmux",https://github.com/ComposioHQ/agent-orchestrator,agent skills
SawyerHood/dev-browser,A Claude Skill to give your agent the ability to use a web browser,5970,387,3,2025-12-02T19:20:20Z,2026-04-23T00:56:12Z,TypeScript,MIT License,SawyerHood,User,"claude-code, playwright, skills",https://github.com/SawyerHood/dev-browser,agent skills
lsdefine/GenericAgent,"Self-evolving agent: grows skill tree from 3.3K-line seed, achieving full system control with 6x less token consumption",5932,645,59,2026-01-16T15:45:24Z,2026-04-23T01:05:19Z,Python,MIT License,lsdefine,User,"ai-agent, automation, autonomous-agent, browser-automation, claude, computer-control, desktop-automation, gemini, lightweight, llm-agent, memory-system, python, self-evolving, skill-tree, task-automation",https://github.com/lsdefine/GenericAgent,agent skills
ChrisWiles/claude-code-showcase,"Comprehensive Claude Code project configuration example with hooks, skills, agents, commands, and GitHub Actions workflows",5830,537,13,2026-01-06T18:51:02Z,2026-04-22T23:21:44Z,JavaScript,,ChrisWiles,User,,https://github.com/ChrisWiles/claude-code-showcase,agent skills
google-labs-code/stitch-skills,"A library of Agent Skills designed to work with the Stitch MCP server. Each skill follows the Agent Skills open standard, for compatibility with coding agents such as Antigravity, Gemini CLI, Claude Code, Cursor.",4728,555,26,2026-01-16T17:17:17Z,2026-04-23T00:42:36Z,TypeScript,Apache License 2.0,google-labs-code,Organization,,https://github.com/google-labs-code/stitch-skills,agent skills
formkit/formkit,The form framework for coding agents,4694,198,154,2021-06-02T21:35:19Z,2026-04-21T10:30:20Z,TypeScript,MIT License,formkit,Organization,"agentic-workflow, agents, form-generation, forms, react, reactjs, skill, skills, validation, vue",https://github.com/formkit/formkit,agent skills
antfu/skills,Anthony Fu's curated collection of agent skills.,4674,250,10,2026-01-28T05:59:03Z,2026-04-23T01:04:25Z,TypeScript,MIT License,antfu,User,"agent-skills, skills",https://github.com/antfu/skills,agent skills
alchaincyf/huashu-design,Huashu Design · HTML-native design skill for Claude Code · Claude Code 里 HTML 原生的设计 skill · 高保真原型 / 幻灯片 / 动画 + 20 设计哲学 + 5 维评审 + MP4 导出 · Agent-agnostic,4456,701,7,2026-04-19T14:42:06Z,2026-04-23T01:10:25Z,HTML,Other,alchaincyf,User,,https://github.com/alchaincyf/huashu-design,agent skills
heilcheng/awesome-agent-skills,"Tutorials, Guides and Agent Skills Directories",4207,400,95,2025-12-29T21:13:40Z,2026-04-22T23:19:09Z,TypeScript,MIT License,heilcheng,User,"agent-skills, ai-agents, ai-development, anthropic, automation, awesome, awesome-list, claude, codex, github-copilot, llm, mcp, openai, productivity, skill-md, vscode",https://github.com/heilcheng/awesome-agent-skills,agent skills
libukai/awesome-agent-skills,"Agent Skills 终极指南：快速入门、资源推荐、精选技能与实用工具 ｜The Ultimate Guide to Agent Skills: QuickStart, Resources, Features&Toolkit",4161,284,29,2025-12-21T12:45:15Z,2026-04-23T00:02:28Z,Python,,libukai,User,"agent, awsome-list, claudecode, openclaw, skills",https://github.com/libukai/awesome-agent-skills,agent skills
xixu-me/awesome-persona-distill-skills,"Curated list of Agent Skills centered on people, relationships, commemorative scenes, and methodological perspectives",4006,445,0,2026-04-06T20:02:21Z,2026-04-23T01:02:19Z,JavaScript,Creative Commons Zero v1.0 Universal,xixu-me,User,"agent-skills, awesome, awesome-list, persona-distill",https://github.com/xixu-me/awesome-persona-distill-skills,agent skills
evalstate/fast-agent,"Code, Build and Evaluate agents - excellent Model and Skills/MCP/ACP Support",3752,402,19,2025-01-18T20:39:51Z,2026-04-22T22:22:37Z,Python,Apache License 2.0,evalstate,User,"acp, agent, agent-framework, agent-skills, cli, mcp, mcp-client, mcp-server, python, skills, tui",https://github.com/evalstate/fast-agent,agent skills
memodb-io/Acontext,Agent Skills as a Memory Layer,3342,313,29,2025-07-16T13:15:48Z,2026-04-22T20:52:33Z,JavaScript,Apache License 2.0,memodb-io,Organization,"agent, agent-development-kit, agent-observability, ai-agent, anthropic, context-data-platform, context-engineering, data-platform, llm, llm-observability, llmops, memory, openai, self-evolving, self-learning",https://github.com/memodb-io/Acontext,agent skills
google-gemini/gemini-skills,"Skills for the Gemini API, SDK and model/agent interactions",3279,292,5,2026-02-06T04:17:28Z,2026-04-23T01:00:23Z,,Apache License 2.0,google-gemini,Organization,"gemini, gemini-api, skills",https://github.com/google-gemini/gemini-skills,agent skills
gotalab/cc-sdd,"Turn approved specs into long-running autonomous implementation. A minimal, adaptable SDD harness with Agent Skills for Claude Code, Codex, Cursor, Copilot, Windsurf, OpenCode, Gemini CLI, and Antigravity.",3166,244,24,2025-07-17T04:41:37Z,2026-04-22T15:14:05Z,TypeScript,MIT License,gotalab,User,"agent-skills, claude-code, codex, cursor, gemini-cli, github-copilot, kiro, opencode, sdd, spec-driven-development, steering, subagents",https://github.com/gotalab/cc-sdd,agent skills
remotion-dev/skills,Agent Skills,2861,329,8,2026-01-19T09:58:43Z,2026-04-23T00:51:44Z,TypeScript,,remotion-dev,Organization,,https://github.com/remotion-dev/skills,agent skills
davepoon/buildwithclaude,"A single hub to find Claude Skills, Agents, Commands, Hooks, Plugins, and Marketplace collections to extend Claude Code, Claude Desktop, Agent SDK and OpenClaw",2791,317,4,2025-07-25T02:26:45Z,2026-04-23T00:09:23Z,Python,MIT License,davepoon,User,"claude, claude-code, claude-code-commands, claude-skills, cli-tool, commands, mcp, mcp-server, mcp-tools, openclaw, plugin-marketplace, subagents",https://github.com/davepoon/buildwithclaude,agent skills
revfactory/harness,"A meta-skill that designs domain-specific agent teams, defines specialized agents, and generates the skills they use.",2782,407,2,2026-03-26T21:22:07Z,2026-04-23T00:56:54Z,HTML,Apache License 2.0,revfactory,User,"claude-code, claude-code-plugin, harness, harness-engineering",https://github.com/revfactory/harness,agent skills
nexu-io/nexu,"The simplest desktop client for OpenClaw 🦞 — bridge your Agent to WeChat, Feishu, Slack & Discord in one click. Works with Claude Code, Codex & any LLM. BYOK, Oauth, local-first, chat from your phone 24/7.",2673,218,273,2026-02-25T02:47:19Z,2026-04-22T17:32:12Z,TypeScript,MIT License,nexu-io,Organization,"ai-agent, byok, claude, claude-code, clawbot, codex, discord, feishu, llm, open-source, openclaw, openclaw-desktop, openclaw-feishu, openclaw-slack, openclaw-wechat, openclaw-weixin, seedance2, skills, slack",https://github.com/nexu-io/nexu,agent skills
coleam00/excalidraw-diagram-skill,Skill to give Claude Code (and any coding agent) the ability to generate beautiful and practical Excalidraw diagrams.,2578,336,16,2026-03-01T12:36:44Z,2026-04-23T00:34:24Z,Python,,coleam00,User,,https://github.com/coleam00/excalidraw-diagram-skill,agent skills
iflytek/skillhub,"Self-hosted, open-source agent skill registry for enterprises. Publish & version skill packages, govern with RBAC and audit logs, deploy   on-premise with Docker or Kubernetes.",2562,338,25,2026-03-11T12:17:05Z,2026-04-23T00:57:48Z,Java,Apache License 2.0,iflytek,Organization,"iflytek-astron, openclaw, openclaw-skills, skill, skill-hub, skill-manager, skills",https://github.com/iflytek/skillhub,agent skills
vuejs-ai/skills,Agent skills for Vue 3 development,2271,129,9,2026-01-21T07:10:27Z,2026-04-23T00:35:51Z,,MIT License,vuejs-ai,Organization,,https://github.com/vuejs-ai/skills,agent skills
microsoft/skills,"Skills, MCP servers, Custom Agents, Agents.md for SDKs to ground Coding Agents",2117,241,38,2026-01-16T18:34:20Z,2026-04-22T23:42:08Z,TypeScript,MIT License,microsoft,Organization,"agent-skills, agents, azure, foundry, mcp, sdk, skills",https://github.com/microsoft/skills,agent skills
NousResearch/hermes-agent-self-evolution,"⚒ Evolutionary self-improvement for Hermes Agent — optimize skills, prompts, and code using DSPy + GEPA",2112,217,26,2026-03-09T10:42:48Z,2026-04-22T22:12:56Z,Python,,NousResearch,Organization,,https://github.com/NousResearch/hermes-agent-self-evolution,agent skills
outsourc-e/hermes-workspace,"Native web workspace for Hermes Agent — chat, terminal, memory, skills, inspector.",2104,243,9,2026-03-16T03:53:28Z,2026-04-23T00:56:48Z,TypeScript,MIT License,outsourc-e,User,"agent-ui, ai-workspace, hackathon, hermes-agent, nous-research, react, typescript",https://github.com/outsourc-e/hermes-workspace,agent skills
rohitg00/pro-workflow,"Claude Code learns from your corrections: self-correcting memory that compounds over 50+ sessions. Context engineering, parallel worktrees, agent teams, and 17 battle-tested skills.",1994,189,3,2026-02-01T19:47:29Z,2026-04-22T22:50:26Z,JavaScript,,rohitg00,User,"agent-orchestration, ai-agents, ai-coding, ai-workflow, claude, claude-code, claude-code-plugin, claude-code-skills, claude-skills, codex, context-engineering, cursor, developer-tools, gemini-cli, hooks, productivity, self-correction, workflow, worktrees",https://github.com/rohitg00/pro-workflow,agent skills
apify/agent-skills,Collection of Apify Agent Skills,1950,206,6,2026-01-07T13:37:31Z,2026-04-22T21:56:12Z,Python,,apify,Organization,,https://github.com/apify/agent-skills,agent skills
RKiding/Awesome-finance-skills,A collection of Awesome Finance Agent Skills for free and easy to start | 一系列开源免费的金融分析Agent Skills,1887,261,2,2026-01-31T06:04:45Z,2026-04-23T00:11:17Z,Python,Apache License 2.0,RKiding,User,"agent, agent-skills, finances, fintech",https://github.com/RKiding/Awesome-finance-skills,agent skills
mgechev/skills-best-practices,"Write professional-grade skills for agents, validate them using LLMs, and maintain a lean context window.",1834,129,0,2026-02-24T19:47:38Z,2026-04-23T00:45:56Z,Python,,mgechev,User,,https://github.com/mgechev/skills-best-practices,agent skills
cisco-ai-defense/skill-scanner,Security Scanner for Agent Skills,1817,221,13,2026-01-29T01:31:32Z,2026-04-22T20:22:56Z,Python,Other,cisco-ai-defense,Organization,"agent, agent-skills, security",https://github.com/cisco-ai-defense/skill-scanner,agent skills
addyosmani/web-quality-skills,Agent Skills for optimizing web quality based on Lighthouse and Core Web Vitals.,1789,151,8,2026-01-18T10:53:04Z,2026-04-22T21:36:40Z,Shell,MIT License,addyosmani,User,"accessibility, agent-skills, claude-skills, core-web-vitals, lighthouse, skills, testing, web-performance",https://github.com/addyosmani/web-quality-skills,agent skills
ljagiello/ctf-skills,"Agent skills for solving CTF challenges - web exploitation, binary pwn, crypto, reverse engineering, forensics, OSINT, and more",1669,228,2,2026-02-01T23:49:52Z,2026-04-22T21:01:17Z,Python,MIT License,ljagiello,User,"agent-skills, claude-code, claude-code-skills, codex, codex-cli, ctf, ctf-challenges, ctf-tools, gemini, gemini-cli, opencode, security",https://github.com/ljagiello/ctf-skills,agent skills
0xNyk/awesome-hermes-agent,"A curated list of awesome skills, tools, integrations, and resources for Hermes Agent by Nous Research",1625,111,4,2026-03-23T05:34:37Z,2026-04-23T01:04:11Z,,Other,0xNyk,User,"ai-agents, awesome, awesome-list, hermes-agent, nous-research, skills",https://github.com/0xNyk/awesome-hermes-agent,agent skills
Ceeon/videocut-skills,用 Claude Code Skills 做的视频剪辑 Agent,1455,239,15,2026-01-14T22:30:01Z,2026-04-22T16:19:03Z,JavaScript,,Ceeon,User,,https://github.com/Ceeon/videocut-skills,agent skills
codejunkie99/agentic-stack,"One brain, many harnesses. Portable .agent/ folder (memory + skills + protocols) that plugs into Claude Code, Cursor, Windsurf, OpenCode, OpenClaw, Hermes, or DIY Python — and keeps its knowledge when you switch.",1436,172,5,2026-04-15T13:45:41Z,2026-04-23T00:33:54Z,Python,Apache License 2.0,codejunkie99,User,,https://github.com/codejunkie99/agentic-stack,agent skills
rohitg00/awesome-claude-code-toolkit,"The most comprehensive toolkit for Claude Code -- 135 agents, 35 curated skills (+400,000 via SkillKit), 42 commands, 176+ plugins, 20 hooks, 15 rules, 7 templates, 14 MCP configs, 26 companion apps, 52 ecosystem entries, and more.",1384,425,23,2026-02-04T21:09:33Z,2026-04-23T00:27:47Z,JavaScript,Apache License 2.0,rohitg00,User,"claude, claude-code, claudecode, claudecode-hooks, plugins, skills",https://github.com/rohitg00/awesome-claude-code-toolkit,agent skills
jjyaoao/HelloAgents,A agent framework based on the tutorial hello-agents,1347,349,22,2025-09-11T07:17:13Z,2026-04-23T01:05:42Z,Python,Other,jjyaoao,User,"agent, agentic-ai, llm, skills",https://github.com/jjyaoao/HelloAgents,agent skills
badlogic/pi-skills,Skills for pi coding agent (compatible with Claude Code and Codex CLI),1329,142,19,2025-12-12T22:00:15Z,2026-04-22T22:02:06Z,JavaScript,MIT License,badlogic,User,,https://github.com/badlogic/pi-skills,agent skills
ibelick/ui-skills,A growing set of skills to polish interfaces built by agents.,1323,58,6,2026-01-07T19:35:54Z,2026-04-22T19:27:42Z,Astro,MIT License,ibelick,User,"skills, ui-skills",https://github.com/ibelick/ui-skills,agent skills
Memento-Teams/Memento-Skills,Memento-Skills: Let Agents Design Agents,1256,129,4,2026-02-13T18:58:55Z,2026-04-22T23:11:05Z,Python,,Memento-Teams,User,,https://github.com/Memento-Teams/Memento-Skills,agent skills
TanStack/cli,"The official TanStack CLI - Project Scaffolding, MCP Server, Agent Skills Installation, etc",1236,165,34,2025-02-14T20:27:40Z,2026-04-22T10:40:44Z,TypeScript,MIT License,TanStack,Organization,,https://github.com/TanStack/cli,agent skills
cloudflare/skills,Skills for teaching agents how to build on Cloudflare.,1232,96,7,2025-12-10T16:45:17Z,2026-04-22T23:40:40Z,,Apache License 2.0,cloudflare,Organization,"agents, cloudflare, skills, workers",https://github.com/cloudflare/skills,agent skills
Genesis-Embodied-AI/RoboGen,A generative and self-guided robotic agent that endlessly propose and master new skills.,1167,107,5,2023-10-31T19:44:09Z,2026-04-22T08:38:31Z,Python,Apache License 2.0,Genesis-Embodied-AI,Organization,,https://github.com/Genesis-Embodied-AI/RoboGen,agent skills
yjl9903/AnimeGarden,動漫花園 镜像站 | 动画 BT 资源聚合站 | 动画 BT 资源开放接口,1157,35,19,2023-04-08T15:00:13Z,2026-04-22T05:10:59Z,TypeScript,GNU Affero General Public License v3.0,yjl9903,User,"agent, animation, anime, anime-tracker, animegarden, animelist, animespace, anitomy, bangumi, dmhy, openapi, scraper, skills, torrent",https://github.com/yjl9903/AnimeGarden,agent skills
luoluoluo22/jianying-editor-skill,Skill for Agent automating JianYing (CapCut Chinese version) video editing.,1124,213,4,2026-01-24T03:10:54Z,2026-04-23T00:59:04Z,Python,MIT License,luoluoluo22,User,,https://github.com/luoluoluo22/jianying-editor-skill,agent skills
dp-archive/archive,Skill Compose is an open-source agent builder and runtime platform for skill-powered agents. No workflow graphs. No CLI.,1107,99,4,2026-02-12T14:11:39Z,2026-04-16T05:09:54Z,Python,Apache License 2.0,dp-archive,User,,https://github.com/dp-archive/archive,agent skills
BankrBot/skills,Bankr Skills equip builders with plug-and-play tools to build more powerful agents.,1089,412,188,2026-01-26T18:45:39Z,2026-04-22T22:18:15Z,Shell,,BankrBot,Organization,skills,https://github.com/BankrBot/skills,agent skills
rohunvora/x-research-skill,"X/Twitter research skill for Claude Code and OpenClaw. Agentic search, thread following, deep-dives, sourced briefings.",1085,108,6,2026-02-08T04:35:51Z,2026-04-22T16:07:49Z,TypeScript,,rohunvora,User,,https://github.com/rohunvora/x-research-skill,agent skills
