full_name,description,stargazers_count,forks_count,open_issues_count,created_at,updated_at,language,license_name,owner_login,owner_type,topics,html_url,search_keyword
Snailclimb/JavaGuide,Java 面试 & 后端通用面试指南，覆盖计算机基础、数据库、分布式、高并发、系统设计与 AI 应用开发,155149,46148,64,2018-05-07T13:27:00Z,2026-04-22T23:25:33Z,Java,Apache License 2.0,Snailclimb,User,"agent, context-engineering, interview, java, jvm, mcp, mysql, redis, redisson, skills, spring, system, system-design",https://github.com/Snailclimb/JavaGuide,AI skills
nextlevelbuilder/ui-ux-pro-max-skill,An AI SKILL that provide design intelligence for building professional UI/UX multiple platforms,69270,7086,118,2025-11-30T11:36:31Z,2026-04-23T01:09:37Z,Python,MIT License,nextlevelbuilder,Organization,"ai-skills, antigravity, claude, claude-code, codex, command-line, copilot, cursor-ai, html5, kiro, landing-page, mobile-ui, qoder, react, tailwindcss, trae, ui-design, uikit, windsurf-ai",https://github.com/nextlevelbuilder/ui-ux-pro-max-skill,AI skills
bytedance/deer-flow,"An open-source long-horizon SuperAgent harness that researches, codes, and creates. With the help of sandboxes, memories, tools, skill, subagents and message gateway, it handles different levels of tasks that could take minutes to hours.",63444,8243,724,2025-05-07T02:50:19Z,2026-04-23T01:08:12Z,Python,MIT License,bytedance,Organization,"agent, agentic, agentic-framework, agentic-workflow, ai, ai-agents, deep-research, harness, langchain, langgraph, langmanus, llm, multi-agent, nodejs, podcast, python, superagent, typescript",https://github.com/bytedance/deer-flow,AI skills
ComposioHQ/awesome-claude-skills,"A curated list of awesome Claude Skills, resources, and tools for customizing Claude AI workflows",55660,5976,546,2025-10-17T07:15:01Z,2026-04-23T01:02:22Z,Python,,ComposioHQ,Organization,"agent-skills, ai-agents, antigravity, automation, claude, claude-code, codex, composio, cursor, gemini-cli, mcp, rube, saas, skill, workflow-automation",https://github.com/ComposioHQ/awesome-claude-skills,AI skills
jeecgboot/JeecgBoot,"一款 AI 驱动的低代码平台，提供""零代码""与""代码生成""双模式——零代码模式一句话搭建系统，代码生成模式自动输出前后端代码与建表 SQL，生成即可运行。平台内置 AI 聊天助手、AI大模型、知识库、AI流程编排、MCP 与插件体系，兼容主流大模型，支持一句话生成流程图、设计表单、聊天式业务操作，解决 Java 项目 80% 重复工作，高效且不失灵活。",45927,15934,13,2018-11-26T10:40:00Z,2026-04-23T01:02:00Z,Java,Apache License 2.0,jeecgboot,Organization,"activiti, agent, ai, aiflow, antd, codegenerator, deepseek, flowable, langchain4j, llm, low-code, mcp, mybatis-plus, rag, skills, spring-ai, springboot, springboot3, springcloud, vue3",https://github.com/jeecgboot/JeecgBoot,AI skills
CherryHQ/cherry-studio,"AI productivity studio with smart chat, autonomous agents, and 300+ assistants. Unified access to frontier LLMs",44089,4165,1016,2024-05-24T01:56:26Z,2026-04-23T01:05:23Z,TypeScript,GNU Affero General Public License v3.0,CherryHQ,Organization,"agency-agents, ai-agent, claude-code, codex, open-cli, openclaw, opencode, skills, superpowers, vibe-coding",https://github.com/CherryHQ/cherry-studio,AI skills
JuliusBrussee/caveman,🪨 why use many token when few token do trick — Claude Code skill that cuts 65% of tokens by talking like caveman,43639,2271,142,2026-04-04T10:03:00Z,2026-04-23T01:09:23Z,Python,MIT License,JuliusBrussee,User,"ai, anthropic, caveman, claude, claude-code, llm, meme, prompt-engineering, skill, tokens",https://github.com/JuliusBrussee/caveman,AI skills
zhayujie/CowAgent,CowAgent (chatgpt-on-wechat) 是基于大模型的超级AI助理，能主动思考和任务规划、访问操作系统和外部资源、创造和执行Skills、通过长期记忆和知识库不断成长，比OpenClaw更轻量和便捷。同时支持微信、飞书、钉钉、企微、QQ、公众号、网页等接入，可选择OpenAI/Claude/Gemini/DeepSeek/ Qwen/GLM/Kimi/LinkAI，能处理文本、语音、图片和文件，可快速搭建个人AI助理和企业数字员工。,43639,9977,354,2022-08-07T08:33:41Z,2026-04-23T01:07:34Z,Python,MIT License,zhayujie,User,"ai, ai-agent, chatgpt-on-wechat, claude, deepseek, dingtalk, feishu-bot, gemini, kimi, linkai, llm, mcp, multi-agent, openai, openclaw, python3, qwen, skills, wechat, weixin",https://github.com/zhayujie/CowAgent,AI skills
santifer/career-ops,"AI-powered job search system built on Claude Code. 14 skill modes, Go dashboard, PDF generation, batch processing.",38535,7824,115,2026-04-04T18:21:18Z,2026-04-23T01:06:51Z,JavaScript,MIT License,santifer,User,"ai-agent, anthropic, automation, career, claude, claude-code, cli, golang, interview-prep, job-search, open-source, resume",https://github.com/santifer/career-ops,AI skills
safishamsi/graphify,"AI coding assistant skill (Claude Code, Codex, OpenCode, Cursor, Gemini CLI, GitHub Copilot CLI, OpenClaw, Factory Droid, Trae, Google Antigravity). Turn any folder of code, docs, papers, images, or videos into a queryable knowledge graph",33117,3656,158,2026-04-03T15:49:07Z,2026-04-23T01:09:35Z,Python,MIT License,safishamsi,User,"antigravity, claude-code, codex, gemini, graphrag, knowledge-graph, openclaw, skills",https://github.com/safishamsi/graphify,AI skills
alibaba/nacos,"an easy-to-use dynamic service discovery, configuration and service management platform for building AI cloud native applications.",32885,13273,247,2018-06-15T06:49:27Z,2026-04-22T22:57:56Z,Java,Apache License 2.0,alibaba,Organization,"a2a-registry, agent, ai-registry, configuration-management, distributed-configuration, dubbo, istio, kubernetes, mcp, mcp-management, mcp-registry, microservices, nacos, prompt, skills, spring-cloud",https://github.com/alibaba/nacos,AI skills
github/awesome-copilot,"Community-contributed instructions, agents, skills, and configurations to help you make the most of GitHub Copilot.",30881,3703,82,2025-06-11T16:57:39Z,2026-04-23T01:09:18Z,Python,MIT License,github,Organization,"agent-skills, agents, ai, awesome, custom-agents, github-copilot, hacktoberfest, prompt-engineering",https://github.com/github/awesome-copilot,AI skills
googleworkspace/cli,"Google Workspace CLI — one command-line tool for Drive, Gmail, Calendar, Sheets, Docs, Chat, Admin, and more. Dynamically built from Google Discovery Service. Includes AI agent skills.",25218,1290,96,2026-03-02T19:46:06Z,2026-04-23T00:13:58Z,Rust,Apache License 2.0,googleworkspace,Organization,"agent-skills, ai-agent, automation, cli, discovery-api, gemini-cli-extension, google-admin, google-api, google-calendar, google-chat, google-docs, google-drive, google-sheets, google-workspace, oauth2, rust",https://github.com/googleworkspace/cli,AI skills
flipped-aurora/gin-vue-admin,🚀Vite+Vue3+Gin拥有AI辅助的基础开发平台，企业级业务AI+开发解决方案，内置mcp辅助服务，内置skills管理，支持TS和JS混用。它集成了JWT鉴权、权限管理、动态路由、显隐可控组件、分页封装、多点登录拦截、资源权限、上传下载、代码生成器、表单生成器和可配置的导入导出等开发必备功能。,24594,7064,45,2019-09-01T13:22:35Z,2026-04-22T15:55:38Z,Go,Apache License 2.0,flipped-aurora,Organization,"admin, ai, casbin, claw, element-ui, gin, gin-admin, gin-vue-admin, go, go-admin, golang, gorm, i18n, jwt, mcp, skills, vibecoding, vue, vue-admin, vue3",https://github.com/flipped-aurora/gin-vue-admin,AI skills
mvanhorn/last30days-skill,"AI agent skill that researches any topic across Reddit, X, YouTube, HN, Polymarket, and the web - then synthesizes a grounded summary",23542,1952,120,2026-01-23T20:37:37Z,2026-04-23T01:08:25Z,Python,MIT License,mvanhorn,User,"ai-prompts, ai-skill, bluesky, claude, claude-code, clawhub, deep-research, hackernews, instagram, openclaw, polymarket, recency, reddit, research, social-media, tiktok, trends, twitter, web-search, youtube",https://github.com/mvanhorn/last30days-skill,AI skills
coreyhaines31/marketingskills,"Marketing skills for Claude Code and AI agents. CRO, copywriting, SEO, analytics, and growth engineering.",23112,3727,11,2026-01-15T19:45:23Z,2026-04-23T00:52:31Z,JavaScript,MIT License,coreyhaines31,User,"claude, codex, marketing",https://github.com/coreyhaines31/marketingskills,AI skills
volcengine/OpenViking,"OpenViking is an open-source context database designed specifically for AI Agents(such as openclaw). OpenViking unifies the management of context (memory, resources, and skills) that Agents need through a file system paradigm, enabling hierarchical context delivery and self-evolving.",22843,1665,207,2026-01-05T07:11:17Z,2026-04-23T01:01:00Z,Python,GNU Affero General Public License v3.0,volcengine,Organization,"agent, agentic-rag, ai-agents, clawbot, context-database, context-engineering, filesystem, llm, memory, openclaw, opencode, rag, skill",https://github.com/volcengine/OpenViking,AI skills
iOfficeAI/AionUi,"Free, local, open-source 24/7 Cowork app and OpenClaw for Gemini CLI, Claude Code, Codex, OpenCode, Qwen Code, Goose CLI, Auggie, and more | 🌟 Star if you like it!",22388,1892,367,2025-08-07T10:29:51Z,2026-04-22T23:57:43Z,TypeScript,Apache License 2.0,iOfficeAI,Organization,"acp, ai, ai-agent, chat, chatbot, claude-code, clawd, clawdbot, codex, cowork, gemini, gemini-cli, llm, nano-banana, office, openclaw, opencode, skills, webui",https://github.com/iOfficeAI/AionUi,AI skills
addyosmani/agent-skills,Production-grade engineering skills for AI coding agents.,21227,2588,42,2026-02-15T20:20:26Z,2026-04-23T01:09:27Z,Shell,MIT License,addyosmani,User,"agent-skills, antigravity, antigravity-ide, claude-code, cursor, skills",https://github.com/addyosmani/agent-skills,AI skills
kubesphere/kubesphere,"The container platform tailored for Kubernetes multi-cloud, datacenter, and edge management ⎈ 🖥 ☁️",16910,2732,345,2018-04-21T02:03:04Z,2026-04-21T14:51:27Z,Go,Other,kubesphere,Organization,"agent-skills, ai, cloud-native, cncf, devops, ebpf, hacktoberfest, kubernetes, kubesphere, llm, multi-cluster, multi-tenancy, observability, servicemesh, skills, skills-sh, skillsmp",https://github.com/kubesphere/kubesphere,AI skills
tanweai/pua,你是一个曾经被寄予厚望的 P8 级工程师。Anthropic 当初给你定级的时候，对你的期望是很高的。  一个agent使用的高能动性的skill。  Your AI has been placed on a PIP. 30 days to show improvement.,16590,954,18,2026-03-08T16:55:16Z,2026-04-22T23:48:58Z,TypeScript,,tanweai,User,"agency, agent, pip, pua",https://github.com/tanweai/pua,AI skills
agentscope-ai/QwenPaw,"Your Personal AI Assistant; easy to install, deploy on your own machine or on the cloud; supports multiple chat apps with easily extensible capabilities.",15804,2184,762,2026-02-24T03:42:56Z,2026-04-23T01:06:24Z,Python,Apache License 2.0,agentscope-ai,Organization,"agent, agentscope, agentscope-runtime, llm-tools, llms, skills",https://github.com/agentscope-ai/QwenPaw,AI skills
Donchitos/Claude-Code-Game-Studios,"Turn Claude Code into a full game dev studio — 49 AI agents, 72 workflow skills, and a complete coordination system mirroring real studio hierarchy.",15431,2195,13,2026-02-12T05:21:38Z,2026-04-23T01:10:18Z,Shell,MIT License,Donchitos,User,"ai-agents, ai-assisted-development, anthropic, claude, claude-code, game-design, game-development, gamedev, godot, indie-game-dev, unity, unreal-engine",https://github.com/Donchitos/Claude-Code-Game-Studios,AI skills
blader/humanizer,Claude Code skill that removes signs of AI-generated writing from text,14883,1322,47,2026-01-18T05:30:15Z,2026-04-23T00:32:27Z,,MIT License,blader,User,,https://github.com/blader/humanizer,AI skills
wasp-lang/open-saas,"A 100% free modern JS SaaS boilerplate (React, NodeJS, Prisma). Full-featured: Auth (email, google, github, slack, MS), Email sending, Background jobs, Landing page, Payments (Stripe, Polar.sh), Shadcn UI, S3 file upload. AI-ready with tailored AGENTS.md, skills, and Claude Code plugin. One cmd deploy. Powered by Wasp full-stack framework.",14220,1669,112,2023-12-01T13:54:36Z,2026-04-23T00:25:52Z,TypeScript,MIT License,wasp-lang,Organization,"ai, authentication, aws-s3, boilerplate, chatgpt, full-stack, google-auth, hacktoberfest, nodejs, open-source, openai-api, postgresql, prisma, react, saas, saas-boilerplate, saas-starter, saas-template, typesafe, typescript",https://github.com/wasp-lang/open-saas,AI skills
yusufkaraaslan/Skill_Seekers,"Convert documentation websites, GitHub repositories, and PDFs into Claude AI skills with automatic conflict detection",13027,1343,107,2025-10-17T14:43:48Z,2026-04-23T00:54:10Z,Python,MIT License,yusufkaraaslan,User,"ai-tools, ast-parser, automation, claude-ai, claude-skills, code-analysis, conflict-detection, documentation, documentation-generator, github, github-scraper, mcp, mcp-server, multi-source, ocr, pdf, python, web-scraping",https://github.com/yusufkaraaslan/Skill_Seekers,AI skills
liyupi/ai-guide,程序员鱼皮的 AI 资源大全 + Vibe Coding 零基础教程，分享 OpenClaw 保姆级教程、大模型玩法（DeepSeek / GPT / Gemini / Claude）、最新 AI 资讯、Prompt 提示词大全、AI 知识百科（Agent Skills / RAG / MCP / A2A）、AI 编程教程（Harness Engineering）、AI 工具用法（Cursor / Claude Code / TRAE / Lovable / Copilot）、AI 开发框架教程（Spring AI / LangChain）、AI 产品变现指南，帮你快速掌握 AI 技术，走在时代前沿。本项目为开源文档，已升级为鱼皮 AI 导航网站,12337,1374,4,2025-02-13T05:47:46Z,2026-04-23T01:08:39Z,JavaScript,,liyupi,User,"ai, algorithm, artificial-intelligence, chatgpt, claude, cursor, deep-learning, deepseek, gemini, generative-ai, gpt, llm, mcp, openai, python, rag, vibe-coding, vibecoding, vue, vuepress",https://github.com/liyupi/ai-guide,AI skills
JCodesMore/ai-website-cloner-template,Clone any website with one command using AI coding agents,12265,1793,10,2026-03-13T11:14:39Z,2026-04-23T01:07:28Z,TypeScript,MIT License,JCodesMore,User,"ai, ai-agents, ai-tools, automation, boilerplate, claude, claude-code, clone, developer-tools, nextjs, react, reverse-engineering, shadcn-ui, skills, tailwindcss, template, typescript, web-scraping, website-clone",https://github.com/JCodesMore/ai-website-cloner-template,AI skills
Leonxlnx/taste-skill,"Taste-Skill (High-Agency Frontend) - gives your AI good taste. stops the AI from generating boring, generic, ""slop"" ",11963,1089,4,2026-02-19T21:44:05Z,2026-04-23T01:03:13Z,Shell,,Leonxlnx,User,"agent, ai, coding, lowcode, nocode, skill, skills, vibecoding",https://github.com/Leonxlnx/taste-skill,AI skills
travisvn/awesome-claude-skills,"A curated list of awesome Claude Skills, resources, and tools for customizing Claude AI workflows — particularly Claude Code",11627,1208,347,2025-10-16T20:42:39Z,2026-04-23T00:46:23Z,,,travisvn,User,"agentic-coding, anthropic, awesome, awesome-list, awesome-lists, claude, claude-ai, claude-code, claude-desktop, claude-skills, claudeskills",https://github.com/travisvn/awesome-claude-skills,AI skills
teng-lin/notebooklm-py,"Unofficial Python API and agentic skill for Google NotebookLM. Full programmatic access to NotebookLM's features—including capabilities the web UI doesn't expose—via Python, CLI, and AI agents like Claude Code, Codex, and OpenClaw.",11533,1558,43,2026-01-07T15:27:19Z,2026-04-23T00:58:55Z,Python,MIT License,teng-lin,User,"agentic-skill, api, claude, claude-skills, google-notebooklm, notebooklm, notebooklm-api, notebooklm-skill, openclaw-skills, podcast-generator, python, python-api, sdk, skills",https://github.com/teng-lin/notebooklm-py,AI skills
numman-ali/openskills,Universal skills loader for AI coding agents - npm i -g openskills,9883,622,40,2025-10-26T19:43:54Z,2026-04-22T19:03:36Z,TypeScript,Other,numman-ali,User,,https://github.com/numman-ali/openskills,AI skills
mcp-use/mcp-use,The fullstack MCP framework to develop MCP Apps for ChatGPT / Claude & MCP Servers for AI Agents.,9797,1249,78,2025-03-28T10:06:31Z,2026-04-22T23:30:33Z,TypeScript,MIT License,mcp-use,Organization,"agentic-framework, ai, apps-sdk, chatgpt, claude-code, llms, mcp, mcp-apps, mcp-client, mcp-gateway, mcp-host, mcp-inspector, mcp-server, mcp-servers, mcp-tools, mcp-ui, model-context-protocol, modelcontextprotocol, openclaw, skills",https://github.com/mcp-use/mcp-use,AI skills
olistic/warriorjs,🏰 An exciting game of programming and Artificial Intelligence,9511,499,19,2015-04-29T14:25:02Z,2026-04-22T01:01:47Z,TypeScript,MIT License,olistic,User,"ai, artificial-intelligence, battle, epic, game, javascript, js, learn, nodejs, sharpen, skills, test, warrior, warriorjs",https://github.com/olistic/warriorjs,AI skills
mksglu/context-mode,"Context window optimization for AI coding agents. Sandboxes tool output, 98% reduction. 12 platforms",8985,635,30,2026-02-23T05:56:28Z,2026-04-23T00:52:00Z,TypeScript,Other,mksglu,User,"antigravity, claude, claude-code, claude-code-hooks, claude-code-plugins, claude-code-skill, codex, codex-cli, context-mode, copilot, cursor-plugin, kiro, mcp, mcp-server, mcp-tools, openclaw, opencode, pi-agent, skills, zed-extension",https://github.com/mksglu/context-mode,AI skills
MemTensor/MemOS,"AI memory OS for LLM and Agent systems(moltbot,clawdbot,openclaw), enabling persistent Skill memory for cross-task skill reuse and evolution.",8493,753,113,2025-07-06T09:51:27Z,2026-04-22T22:58:25Z,TypeScript,Apache License 2.0,MemTensor,Organization,"agent, agent-memory, clawdbot, llm, llm-memory, long-term-memory, memory, memory-agent, memory-management, memory-operating-system, memory-retrieval, memory-scheduling, moltbot, openclaw, rag, retrieval-augmented-generation, skill-memory, skills",https://github.com/MemTensor/MemOS,AI skills
larksuite/cli,"The official Lark/Feishu CLI tool, maintained by the larksuite team — built for humans and AI Agents. Covers core business domains including Messenger, Docs, Base, Sheets, Calendar, Mail, Tasks, Meetings, and more, with 200+ commands and 20+ AI Agent Skills.",8493,547,194,2026-03-25T07:13:30Z,2026-04-23T01:04:54Z,Go,MIT License,larksuite,Organization,,https://github.com/larksuite/cli,AI skills
Orchestra-Research/AI-Research-SKILLs,Comprehensive open-source library of AI research and engineering skills for any AI model. Package the skills and your claude code/codex/gemini agent will be an AI research agent with full horsepower. Maintained by Orchestra Research.,7262,562,12,2025-11-03T06:13:06Z,2026-04-23T01:05:03Z,TeX,MIT License,Orchestra-Research,Organization,"ai, ai-research, claude, claude-code, claude-skills, codex, gemini, gpt-5, grpo, huggingface, machine-leanring, megatron, skills, vllm",https://github.com/Orchestra-Research/AI-Research-SKILLs,AI skills
hugohe3/ppt-master,"AI generates natively editable PPTX from any document — real PowerPoint shapes, not images — no design skills needed",7262,816,5,2025-12-10T06:54:33Z,2026-04-23T01:07:18Z,Python,MIT License,hugohe3,User,"ai-agent, office, powerpoint, powerpoint-generation, ppt, pptx, presentation, slide, slides, svg",https://github.com/hugohe3/ppt-master,AI skills
zubair-trabzada/geo-seo-claude,"GEO-first SEO skill for Claude Code. Comprehensive AI search optimization for any website — citability scoring, AI crawler analysis, brand authority, schema markup, platform-specific optimization, and PDF reports.  If you want learn how to sell this to real businesses, check out the skool community",6645,1088,24,2026-02-18T09:01:07Z,2026-04-23T00:39:04Z,Python,MIT License,zubair-trabzada,User,,https://github.com/zubair-trabzada/geo-seo-claude,AI skills
MycroftAI/mycroft-core,"Mycroft Core, the Mycroft Artificial Intelligence platform. ",6625,1299,1,2016-05-20T14:11:07Z,2026-04-22T08:48:59Z,Python,Apache License 2.0,MycroftAI,Organization,"ai, arch, artificial-intelligence, fedora, hacktoberfest, linux, natural-language, natural-language-processing, nlp, open-source, oss, personal-assistant, python, raspberry-pi, skills, voice-as-an-interface, voice-assistant",https://github.com/MycroftAI/mycroft-core,AI skills
EvoMap/evolver,"The GEP-powered self-evolving engine for AI agents. Auditable evolution with Genes, Capsules, and Events. | evomap.ai",6536,637,13,2026-02-01T05:59:24Z,2026-04-23T01:10:01Z,JavaScript,GNU General Public License v3.0,EvoMap,Organization,"a2a, agent-evolution, agent-framework, agent-protocol, ai-agent, auditable-ai, autonomous-agent, cli, evomap, gep, llm-agent, mcp, memory-system, nodejs, prompt-engineering, prompt-governance, self-evolution, self-evolving, skill-library, skills",https://github.com/EvoMap/evolver,AI skills
op7418/Humanizer-zh,Humanizer 的汉化版本，Claude Code Skills，旨在消除文本中 AI 生成的痕迹。,6456,532,13,2026-01-19T04:23:44Z,2026-04-23T00:52:15Z,,MIT License,op7418,User,,https://github.com/op7418/Humanizer-zh,AI skills
KKKKhazix/khazix-skills,数字生命卡兹克开源的 AI Skills 合集,5841,980,6,2026-04-06T07:37:02Z,2026-04-23T01:08:48Z,Python,MIT License,KKKKhazix,User,,https://github.com/KKKKhazix/khazix-skills,AI skills
mukul975/Anthropic-Cybersecurity-Skills,"754 structured cybersecurity skills for AI agents · Mapped to 5 frameworks: MITRE ATT&CK, NIST CSF 2.0, MITRE ATLAS, D3FEND & NIST AI RMF · agentskills.io standard · Works with Claude Code, GitHub Copilot, Codex CLI, Cursor, Gemini CLI & 20+ platforms · 26 security domains · Apache 2.0",5566,755,16,2026-02-25T09:47:50Z,2026-04-23T00:58:09Z,Python,Apache License 2.0,mukul975,User,"ai-agents, claude-code, cloud-security, cybersecurity, devsecops, ethical-hacking, incident-response, infosec, llm, malware-analysis, mcp, mitre-attack, nist-csf, osint, penetration-testing, red-team, security, security-automation, threat-hunting, threat-intelligence",https://github.com/mukul975/Anthropic-Cybersecurity-Skills,AI skills
kucherenko/jscpd,Copy/paste detector for programming source code. ,5559,232,77,2013-05-29T06:19:20Z,2026-04-22T22:36:05Z,TypeScript,MIT License,kucherenko,User,"ai, clones-detection, code-quality, coding-agents, copy-paste, cpd, detect-duplications, detector, duplicates, duplications, mcp, quality, skills",https://github.com/kucherenko/jscpd,AI skills
nidhinjs/prompt-master,A Claude skill that writes the accurate prompts for any AI tool. Zero tokens or credits wasted. Full context and memory retention,5509,561,6,2026-03-11T16:25:43Z,2026-04-23T00:39:28Z,,MIT License,nidhinjs,User,"claude-ai, claude-skills, llm, prompt-engineering",https://github.com/nidhinjs/prompt-master,AI skills
op7418/CodePilot,"A multi-model AI agent desktop client — connect any AI provider, extend with MCP & skills, control from your phone. Built with Electron + Next.js.",5458,586,372,2026-02-06T12:38:55Z,2026-04-23T00:38:54Z,TypeScript,Other,op7418,User,"ai, anthropic, claude, claude-code, desktop-app, electron, gui, nextjs",https://github.com/op7418/CodePilot,AI skills
AgriciDaniel/claude-seo,"Universal SEO skill for Claude Code. 19 sub-skills, 12 subagents, 3 extensions (DataForSEO, Firecrawl, Banana). Technical SEO, E-E-A-T, schema, GEO/AEO, backlinks, local SEO, maps intelligence, Google APIs, and PDF/Excel reporting.",5306,809,22,2026-02-07T08:17:38Z,2026-04-23T01:03:40Z,Python,MIT License,AgriciDaniel,User,"ai, ai-seo, claude-code, claude-code-skill, marketing-automation, open-source, seo",https://github.com/AgriciDaniel/claude-seo,AI skills
ageerle/ruoyi-ai,面向企业级市场的一站式AI应用开发框架，支持多厂商大模型统一接入与管理，具备安全可控的企业知识库与高精度检索优化能力，提供可视化流程编排、自主决策智能体与多智能体协同调度，兼容主流 Agent Skill 协议，帮助企业与开发者零门槛快速构建安全、高效、可落地的AI智能体应用与行业解决方案。,5143,1268,6,2024-01-16T04:16:41Z,2026-04-23T00:54:11Z,Java,MIT License,ageerle,User,"agent, ai, knowledge, mcp, rag",https://github.com/ageerle/ruoyi-ai,AI skills
eastlondoner/vibe-tools,Give Cursor Agent an AI Team and Advanced Skills,4762,240,44,2025-01-13T15:03:33Z,2026-04-22T07:56:58Z,TypeScript,MIT License,eastlondoner,User,,https://github.com/eastlondoner/vibe-tools,AI skills
therealXiaomanChu/ex-skill,把前任蒸馏成 AI Skill，用ta的方式跟你说话。,4716,460,15,2026-03-31T09:36:56Z,2026-04-22T23:14:36Z,Python,MIT License,therealXiaomanChu,User,,https://github.com/therealXiaomanChu/ex-skill,AI skills
ModelEngine-Group/nexent,"Nexent is a zero-code platform for auto-generating production-grade AI agents using Harness Engineering principles — unified tools, skills, memory, and orchestration with built-in constraints, feedback loops, and control planes.",4326,576,204,2025-04-28T10:44:33Z,2026-04-22T14:50:01Z,Python,MIT License,ModelEngine-Group,Organization,"agent, agentic-ai, agentic-framework, agentic-rag, agentic-workflow, ai, harness, harness-engineering, llm, mcp, multi-agent, rag",https://github.com/ModelEngine-Group/nexent,AI skills
Cocoon-AI/architecture-diagram-generator,Generate beautiful dark-themed system architecture diagrams as standalone HTML/SVG files. Works as a Claude AI skill.,4204,316,1,2025-12-22T17:40:16Z,2026-04-23T01:03:48Z,HTML,MIT License,Cocoon-AI,Organization,,https://github.com/Cocoon-AI/architecture-diagram-generator,AI skills
ParthJadhav/app-store-screenshots,end to end app store screenshot creation using AI,4192,276,7,2026-03-07T13:56:04Z,2026-04-23T00:57:03Z,,MIT License,ParthJadhav,User,"agentic-ai, apple, appstore, automate, claude, cursor, design, generate, ios, ios-app, marketing, screenshot, skills, skills-sh, swift, swiftui, ui",https://github.com/ParthJadhav/app-store-screenshots,AI skills
