full_name,description,stargazers_count,forks_count,open_issues_count,created_at,updated_at,language,license_name,owner_login,owner_type,topics,html_url,search_keyword
Master-cai/Research-Paper-Writing-Skills,"Skill package for ML/CV/NLP paper writing, curated and adapted from Prof. Peng Sida's open notes for Codex, Claude Code, and Gemini.",1499,64,2,2026-03-05T08:19:31Z,2026-04-23T01:04:51Z,,,Master-cai,User,,https://github.com/Master-cai/Research-Paper-Writing-Skills,claude skills
joeseesun/qiaomu-anything-to-notebooklm,"Claude Skill: Multi-source content processor for NotebookLM. Supports WeChat articles, web pages, YouTube, PDF, Markdown, search queries → Podcast/PPT/MindMap/Quiz etc.",1399,157,3,2026-01-25T14:48:01Z,2026-04-23T00:51:52Z,Python,MIT License,joeseesun,User,"automation, claude, mcp, notebooklm, skill",https://github.com/joeseesun/qiaomu-anything-to-notebooklm,claude skills
skills-directory/skill-codex,A claude code skill to delegate prompts to codex,1182,89,1,2025-10-21T19:28:43Z,2026-04-23T00:56:14Z,,MIT License,skills-directory,Organization,"claude, claude-code, codex",https://github.com/skills-directory/skill-codex,claude skills
rjs/shaping-skills,Skills I use with Claude for shaping,997,71,8,2026-01-29T11:48:29Z,2026-04-23T00:34:07Z,Shell,,rjs,User,,https://github.com/rjs/shaping-skills,claude skills
tradermonty/claude-trading-skills,"Claude Code skills for equity investors and traders — market analysis, technical charting, economic calendars, screeners, and trading strategy development.",995,220,2,2025-10-19T16:37:29Z,2026-04-23T01:05:11Z,Python,MIT License,tradermonty,User,,https://github.com/tradermonty/claude-trading-skills,claude skills
adamlyttleapps/claude-skill-app-onboarding-questionnaire," A Claude Code skill that designs and builds high-converting questionnaire-style app onboarding flows — modelled    on proven conversion patterns from top subscription apps like Mob, Headspace and Noom",939,109,3,2026-04-06T11:00:14Z,2026-04-22T18:50:15Z,,MIT License,adamlyttleapps,User,,https://github.com/adamlyttleapps/claude-skill-app-onboarding-questionnaire,claude skills
yzfly/douyin-mcp-server,提取抖音无水印视频链接，视频文案，douyin-mcp-server，mcp，claude skill，支持龙虾,934,186,0,2025-05-22T06:22:43Z,2026-04-22T22:59:09Z,HTML,Apache License 2.0,yzfly,User,"agentskills, claude, claudeskills, douyin, llm, mcp, skills, video, video-processing",https://github.com/yzfly/douyin-mcp-server,claude skills
simonw/claude-skills,The contents of /mnt/skills in Claude's code interpreter environment,920,135,1,2025-10-10T02:04:10Z,2026-04-21T05:38:51Z,,,simonw,User,,https://github.com/simonw/claude-skills,claude skills
daymade/claude-code-skills,Professional Claude Code skills marketplace featuring production-ready skills for enhanced development workflows.,919,146,11,2025-10-22T11:17:31Z,2026-04-22T22:39:03Z,Python,MIT License,daymade,User,,https://github.com/daymade/claude-code-skills,claude skills
SynaLinks/synalinks-skills,Claude skills for Synalinks OSS,896,85,1,2023-06-17T16:31:00Z,2026-04-21T08:31:43Z,Python,Apache License 2.0,SynaLinks,Organization,"artificial-intelligence, large-language-models, neuro-symbolic, neuro-symbolic-ai, neurosymbolic",https://github.com/SynaLinks/synalinks-skills,claude skills
CharlesWiltgen/Axiom,"Battle-tested Claude Code skills for modern xOS (iOS, iPadOS, watchOS, tvOS) development",845,65,6,2025-11-30T17:40:05Z,2026-04-22T23:46:36Z,Go,MIT License,CharlesWiltgen,User,,https://github.com/CharlesWiltgen/Axiom,claude skills
dgreenheck/webgpu-claude-skill,A Claude skill for developing WebGPU applications with Three.js,837,72,3,2026-01-23T02:51:19Z,2026-04-23T00:27:07Z,JavaScript,,dgreenheck,User,,https://github.com/dgreenheck/webgpu-claude-skill,claude skills
BehiSecc/VibeSec-Skill,This skill helps Claude write secure code and prevent common vulnerabilities.,792,70,0,2026-02-02T07:10:42Z,2026-04-22T21:16:19Z,,Apache License 2.0,BehiSecc,User,,https://github.com/BehiSecc/VibeSec-Skill,claude skills
P4nda0s/reverse-skills,Reverse engineering skills for Claude Code | 逆向工程 Claude Code Skills 插件,787,113,0,2026-01-22T10:32:10Z,2026-04-22T23:41:36Z,,,P4nda0s,User,,https://github.com/P4nda0s/reverse-skills,claude skills
hamen/material-3-skill,"Material Design 3 skill for Claude Code — 30+ components, design tokens, theming, responsive layout, and MD3 compliance audit",785,39,1,2026-04-09T14:19:09Z,2026-04-22T20:12:56Z,,MIT License,hamen,User,,https://github.com/hamen/material-3-skill,claude skills
BrownFineSecurity/iothackbot,IoT HackBot: A collection of Claude Skills and custom tooling for hybrid IoT pentesting,738,111,5,2025-11-17T15:18:28Z,2026-04-21T11:24:59Z,Python,MIT License,BrownFineSecurity,Organization,,https://github.com/BrownFineSecurity/iothackbot,claude skills
wshuyi/x-article-publisher-skill,Claude Code skill for publishing Markdown articles to X (Twitter) Articles,734,71,5,2025-12-31T00:19:52Z,2026-04-21T16:35:46Z,Python,MIT License,wshuyi,User,,https://github.com/wshuyi/x-article-publisher-skill,claude skills
alirezarezvani/claude-code-tresor,"A world-class collection of Claude Code utilities: autonomous skills, expert agents, slash commands, and prompts that supercharge your development workflow",693,157,1,2025-09-16T09:35:02Z,2026-04-22T17:43:18Z,Shell,MIT License,alirezarezvani,User,"agent-development-kit, agentic-ai, agentic-coding, agentic-workflow, agents, anthropic-claude, claude-code",https://github.com/alirezarezvani/claude-code-tresor,claude skills
coleam00/second-brain-skills,A collection of Claude Skills to turn Claude Code into a Second Brain,689,199,1,2026-01-24T15:50:45Z,2026-04-22T12:32:30Z,Python,,coleam00,User,,https://github.com/coleam00/second-brain-skills,claude skills
JuliusBrussee/cavekit,"A Claude Code plugin that turns natural language into blueprints, blueprints into parallel build plans, and build plans into working software with automated iteration, validation, and cross-model peer review.",673,48,10,2026-03-14T23:59:42Z,2026-04-23T00:45:28Z,,MIT License,JuliusBrussee,User,"claude-code, parallel-agents, skills, spec-driven-development, test-driven-development",https://github.com/JuliusBrussee/cavekit,claude skills
iannuttall/dotagents,"One location for all of your hooks, commands, skills, and AGENT/CLAUDE.md files.",672,27,7,2026-01-06T15:53:10Z,2026-04-23T00:47:00Z,TypeScript,MIT License,iannuttall,User,,https://github.com/iannuttall/dotagents,claude skills
deusyu/translate-book,Claude Code skill that translates entire books (PDF/DOCX/EPUB) into any language using parallel subagents,635,64,5,2026-03-15T12:04:50Z,2026-04-22T09:21:37Z,Python,MIT License,deusyu,User,,https://github.com/deusyu/translate-book,claude skills
fcakyon/claude-codex-settings,"My personal Claude Code and OpenAI Codex setup with battle-tested skills, plugins, hooks and agents that I use daily.",631,57,11,2025-07-09T07:46:08Z,2026-04-22T20:07:18Z,Python,Apache License 2.0,fcakyon,User,"ai-agents, ai-tools, claude-ai, claude-code, claude-code-plugin, claude-skills, claudecode, claudecode-config, codex, codex-cli, commit-message, cursor, dokploy, frontend-design, gemini-cli, github, hetzner, plugin, pull-requests, slack",https://github.com/fcakyon/claude-codex-settings,claude skills
abubakarsiddik31/claude-skills-collection,"A curated collection of official and community-built Claude Skills – extend Anthropic's Claude with powerful, modular capabilities for productivity, creativity, coding, and more.",623,80,6,2025-10-18T16:24:12Z,2026-04-22T09:19:48Z,,,abubakarsiddik31,User,,https://github.com/abubakarsiddik31/claude-skills-collection,claude skills
obra/superpowers-skills,Community-editable skills for Claude Code's superpowers plugin,623,141,7,2025-10-11T17:06:05Z,2026-04-22T18:48:23Z,TypeScript,MIT License,obra,User,,https://github.com/obra/superpowers-skills,claude skills
tripleyak/SkillForge,"Intelligent skill router and creator for Claude Code and Codex. Analyzes any input to recommend existing skills, improve them, or create new ones from scratch.",594,68,0,2025-12-30T01:02:27Z,2026-04-22T21:43:27Z,Python,MIT License,tripleyak,User,"claude-ai, claude-code, claude-skills",https://github.com/tripleyak/SkillForge,claude skills
SafeRL-Lab/cheetahclaws,"CheetahClaws (Nano Claude Code): A Fast, Easy-to-Use, Python-Native Personal AI Assistant for Any Model, Inspired by OpenClaw and Claude Code, Built to Work for You Autonomously 24/7.",592,221,22,2026-04-01T15:23:36Z,2026-04-22T15:45:14Z,Python,Apache License 2.0,SafeRL-Lab,Organization,"agentic-ai, claude, claude-code, memory, openclaw, python, skills",https://github.com/SafeRL-Lab/cheetahclaws,claude skills
Astro-Han/karpathy-llm-wiki,"Agent Skills-compatible LLM wiki for Claude Code, Cursor, and Codex. Build a Karpathy-style knowledge base from raw sources, citations, and linting.",579,72,1,2026-04-05T06:17:20Z,2026-04-23T00:49:26Z,,MIT License,Astro-Han,User,"agent-skill, claude-code, codex, cursor, karpathy, knowledge-base, knowledge-management, llm, llm-wiki, markdown, personal-knowledge-base, productivity, rag-alternative",https://github.com/Astro-Han/karpathy-llm-wiki,claude skills
huangkiki/dailypaper-skills,用Claude Code skills打造我的论文流水线,570,61,4,2026-02-26T15:19:19Z,2026-04-22T19:32:26Z,Python,Apache License 2.0,huangkiki,User,,https://github.com/huangkiki/dailypaper-skills,claude skills
hashicorp/agent-skills,A collection of Agent skills and Claude Code plugins for HashiCorp products.,563,70,26,2025-11-08T02:07:20Z,2026-04-22T13:43:57Z,Shell,Mozilla Public License 2.0,hashicorp,Organization,doormat-managed,https://github.com/hashicorp/agent-skills,claude skills
mhattingpete/claude-skills-marketplace,"Claude Code Skills for software engineering workflows - Git automation, testing, and code review",557,66,10,2025-10-17T12:02:19Z,2026-04-22T11:05:24Z,HTML,Apache License 2.0,mhattingpete,User,"ai-agents, ai-tools, anthropic, automation, claude-code, claude-skills, developer-tools, plugins, productivity",https://github.com/mhattingpete/claude-skills-marketplace,claude skills
rokpiy/auto-commenter,"A Claude skill that automatically posts personalized, authentic comments in your target communities.",556,119,0,2026-01-28T09:02:10Z,2026-04-20T01:13:06Z,,MIT License,rokpiy,User,"automation, chatgpt, claude-ai, comment, cursor-ai, mcp, openclaw, openclaw-skills, playwright, reddit",https://github.com/rokpiy/auto-commenter,claude skills
yunshu0909/yunshu_skillshub,云舒精选的 Claude Code Skills 集合，提升开发和产品管理效率,546,80,1,2026-01-19T00:43:39Z,2026-04-22T14:47:33Z,Python,MIT License,yunshu0909,User,,https://github.com/yunshu0909/yunshu_skillshub,claude skills
tfriedel/claude-office-skills,"Office document creation and editing skills for Claude Code - PPTX, DOCX, XLSX, and PDF workflows with automation support",543,89,3,2025-10-04T14:24:13Z,2026-04-22T23:45:43Z,Python,,tfriedel,User,,https://github.com/tfriedel/claude-office-skills,claude skills
lijigang/ljg-skill-xray-paper,论文X光机 — Claude Code Skill，解构学术论文，提炼餐巾纸公式,543,39,2,2026-02-08T05:01:33Z,2026-04-21T13:24:44Z,,MIT License,lijigang,User,,https://github.com/lijigang/ljg-skill-xray-paper,claude skills
zhuyansen/wx-favorites-report,微信收藏可视化 Claude Code Skill — 从加密 DB 到交互式 HTML 报告的端到端管线,539,112,0,2026-04-16T02:58:42Z,2026-04-23T00:45:41Z,Python,,zhuyansen,User,,https://github.com/zhuyansen/wx-favorites-report,claude skills
Railly/agentfiles,"Browse, create, and edit AI agent files across Claude Code, Cursor, Codex, and 13+ tools — from Obsidian.",529,27,3,2026-03-28T13:17:02Z,2026-04-22T11:55:10Z,TypeScript,MIT License,Railly,User,"agent-skills, ai-agents, ai-tools, claude-code, codex, coding-agents, copilot, cursor, developer-tools, dotfiles, obsidian, obsidian-plugin, skills, windsurf",https://github.com/Railly/agentfiles,claude skills
199-biotechnologies/claude-deep-research-skill,"Enterprise-grade deep research skill for Claude Code with 8-phase pipeline, source credibility scoring, and automated validation. Outperforms OpenAI, Gemini, and Claude Desktop in quality and verification.",520,51,1,2025-11-04T15:45:07Z,2026-04-22T21:23:26Z,Python,,199-biotechnologies,Organization,,https://github.com/199-biotechnologies/claude-deep-research-skill,claude skills
antvis/mcp-server-chart,🤖 A visualization mcp & skills contains 25+ visual charts using @antvis. Using for chart generation and data analysis.,3996,370,12,2025-04-25T09:10:06Z,2026-04-22T19:25:22Z,TypeScript,MIT License,antvis,Organization,"antv, llm, mcp, mcp-server, skills, visualization",https://github.com/antvis/mcp-server-chart,LLM skills
successfulstudy/promptoftheyear,"In the evolving world of Large Language Models (LLMs), crafting effective prompts has become an essential skill. That's why I've created this collection, showcasing the most impactful prompts of the year across various intriguing domains. 🌐",1483,75,2,2023-12-12T05:17:16Z,2026-04-20T16:41:34Z,,,successfulstudy,User,"chatgpt, prompts, prompts-template",https://github.com/successfulstudy/promptoftheyear,LLM skills
Tebmer/Awesome-Knowledge-Distillation-of-LLMs,"This repository collects papers for ""A Survey on Knowledge Distillation of Large Language Models"". We break down KD into Knowledge Elicitation and Distillation Algorithms, and explore the Skill & Vertical Distillation of LLMs.",1277,72,2,2024-02-08T16:04:45Z,2026-04-22T03:55:18Z,,,Tebmer,User,"alignment, compression, data-augmentation, data-synthesis, feedback, instruction-following, kd, knowledge-distillation, large-language-model, llm, multi-modal, self-distillation, self-training, supervised-finetuning, survey",https://github.com/Tebmer/Awesome-Knowledge-Distillation-of-LLMs,LLM skills
sdyckjq-lab/llm-wiki-skill,基于 Karpathy llm-wiki 方法论的个人知识库构建 Skill，支持多平台！,1009,146,8,2026-04-05T05:27:07Z,2026-04-23T00:45:41Z,Shell,,sdyckjq-lab,User,,https://github.com/sdyckjq-lab/llm-wiki-skill,LLM skills
ComposioHQ/awesome-codex-skills,A curated list of practical Codex skills for automating workflows across the Codex CLI and API.,841,98,17,2026-01-12T11:58:21Z,2026-04-23T00:59:17Z,Python,,ComposioHQ,Organization,"codex, codex-cli, codex-skills, coding-agent-skills, coding-agents, gpt-5-1-codex, gpt-5-codex, llm, skills",https://github.com/ComposioHQ/awesome-codex-skills,LLM skills
Shy2593666979/AgentChat,AgentChat 是一个基于 LLM 的智能体交流平台，内置默认 Agent 并支持用户自定义 Agent。通过多轮对话和任务协作，Agent 可以理解并协助完成复杂任务。项目集成 LangChain、Function Call、MCP 协议、RAG、Memory、HITL、Skill、Milvus 和 ElasticSearch 等技术，实现高效的知识检索与工具调用，使用 FastAPI 构建高性能后端服务。,670,83,24,2024-08-20T16:00:12Z,2026-04-22T15:22:27Z,Python,MIT License,Shy2593666979,User,"agent, agent-memory, agent-skills, human-in-the-loop, langchain, llm, mcp, mcp-client, mcp-server, mysql, redis",https://github.com/Shy2593666979/AgentChat,LLM skills
qualisero/awesome-pi-agent,"Awesome list of add-ons, hooks, tools, skills, and resources for the pi coding agent (pi-mono).",577,39,18,2026-01-05T06:48:06Z,2026-04-22T21:07:21Z,JavaScript,MIT License,qualisero,Organization,"agentic-ai, llm, pi, pi-agent",https://github.com/qualisero/awesome-pi-agent,LLM skills
agentscope-ai/OpenJudge,OpenJudge: A Unified Framework for Holistic Evaluation and Quality Rewards,570,46,10,2025-07-08T06:17:01Z,2026-04-22T08:50:18Z,Python,Apache License 2.0,agentscope-ai,Organization,"agent, agent-skills, ai-agent, alignment, evaluation, grader, llm, reward, reward-model, rlhf, skill-md, skills",https://github.com/agentscope-ai/OpenJudge,LLM skills
openvort/openvort,"Open-source AI Employee Platform — Create AI employees that collaborate with your real team in WeCom, DingTalk, and Feishu, just like hiring a few more colleagues.",541,83,2,2026-03-02T03:01:29Z,2026-04-22T14:50:02Z,Python,GNU Affero General Public License v3.0,openvort,User,"ai-agent, ai-employee, chatbot, enterprise, llm, openvort, plugin-system, plugins, python, skills, vortflow, wecom",https://github.com/openvort/openvort,LLM skills
TheDecipherist/claude-code-mastery,"The complete guide to Claude Code: CLAUDE.md, hooks, skills, MCP servers, and commands",498,43,2,2026-01-14T18:19:47Z,2026-04-21T23:41:22Z,Shell,MIT License,TheDecipherist,User,"ai-agents, anthropic, claude, claude-code, claude-md, coding-assistant, developer-tools, llm, mcp-servers",https://github.com/TheDecipherist/claude-code-mastery,LLM skills
didilili/ai-agents-from-zero, 🚀 2026 最系统的 AI Agent 速成指南｜智能体实战教程 · 完整学习路径  + 实战项目 + 面试题库 · 对标大模型应用开发工程师岗位 · 覆盖LangChain / LangGraph / Coze / Dify / MCP / skills / LLM / RAG / 提示词 · 企业级部署与微调 · 从0到企业级落地 + 从学习到上线项目 + 面试准备一体化 ,454,73,2,2026-01-29T02:49:11Z,2026-04-23T01:07:41Z,Python,MIT License,didilili,User,"agent, agent-framework, ai-agent, aigc, coze, dify, gpt, langchain, langgraph, llm, mcp, rag, skills, tutorial",https://github.com/didilili/ai-agents-from-zero,LLM skills
xu-xiang/everything-claude-code-zh,"everything-claude-code 中文翻译项目：完整的 Claude Code 配置集合（agents, skills, hooks, commands, rules, MCPs）。源自 Anthropic 黑客松获胜者的实战配置，助力中文工程师高效理解与使用 Claude Code。",452,91,1,2026-01-27T14:46:32Z,2026-04-22T16:32:37Z,JavaScript,MIT License,xu-xiang,User,"ai-agents, anthropic, claude, claude-code, developer-tools, everything-claude-code, llm, mcp, oneskill, productivity",https://github.com/xu-xiang/everything-claude-code-zh,LLM skills
iamzhihuix/skills-manage,"Desktop app to manage AI coding agent skills across Claude Code, Cursor, Gemini CLI, Codex, and 20+ platforms from one place.",414,31,2,2026-04-13T05:03:06Z,2026-04-23T01:10:47Z,TypeScript,Apache License 2.0,iamzhihuix,User,"ai, claude-code, cursor, desktop-app, llm, react, rust, skills, tauri",https://github.com/iamzhihuix/skills-manage,LLM skills
Bhanunamikaze/Agentic-SEO-Skill,"An LLM-first SEO analysis skill for Antigravity, Codex, Claude with 16 specialized sub-skills, 10 specialist agents, and 33 optional utility scripts used as evidence collectors.",412,74,2,2026-03-02T17:37:53Z,2026-04-22T20:49:21Z,Python,MIT License,Bhanunamikaze,User,"ai-skill, ai-skills, antigravity-ai, antigravity-skills, antigravity-tools, claude-skill, claude-skills, codex-skill, codex-skills, seo, seo-optimization, skills",https://github.com/Bhanunamikaze/Agentic-SEO-Skill,LLM skills
aldefy/compose-skill,"Jetpack Compose Agent Skill — AI-powered coding guidance with actual androidx/androidx source code receipts. Works with Claude Code, Codex CLI, Gemini CLI, Cursor, Copilot, Windsurf, and more.",406,25,1,2026-02-28T06:00:36Z,2026-04-22T14:32:43Z,Shell,Other,aldefy,User,"agent-skill, ai-agent, ai-coding, android, androidx, claude-code, codex, compose, compose-multiplatform, copilot, cursor, developer-tools, gemini-cli, jetpack-compose, kotlin, llm, material3",https://github.com/aldefy/compose-skill,LLM skills
instavm/open-skills,OpenSkills: Run Claude Skills Locally using any LLM,403,34,2,2025-10-26T18:09:49Z,2026-04-22T18:24:19Z,Python,Apache License 2.0,instavm,Organization,"ai, claude, gemini-cli, mcp, ollama, opencode, privacy, qwen-cli, skills",https://github.com/instavm/open-skills,LLM skills
kimtth/awesome-azure-openai-llm,"A curated collection of resources for 🌌 Azure OpenAI, 🦙 LLMs (+RAG, Agents). Monthly Updates.",397,52,2,2023-04-13T07:56:41Z,2026-04-23T01:01:11Z,Python,,kimtth,User,"agent, agent-framework, ai-agent, ai-engineering, ai-tools, awesome-list, azure-openai, claude, coding-agent, copilot, gpt, harness, llm, llmops, openai, prompt-engineering, rag, research-paper, skills, survey-paper",https://github.com/kimtth/awesome-azure-openai-llm,LLM skills
feder-cr/resume_render_from_job_description,"Resume_Builder_AIHawk is a powerful Python tool that allows you to automatically customize your resume based on a job URL, ensuring it perfectly aligns with the job requirements and skills. With an interactive command-line interface, this tool makes it easy to navigate through options and select from various pre-defined styles",395,91,3,2024-08-15T14:24:48Z,2026-04-19T11:06:19Z,Python,MIT License,feder-cr,User,"artificial-intelligence, interview, jobs, jobsearch, langchain, linkedin, llm, openai, python, resume-builder, scraper, time-saving",https://github.com/feder-cr/resume_render_from_job_description,LLM skills
Th0rgal/sandboxed.sh,"Self-hosted orchestrator for AI autonomous agents. Run Claude Code & Open Code in isolated linux workspaces. Manage your skills, configs and encrypted secrets with a git repo.",393,40,14,2025-12-15T10:15:26Z,2026-04-22T22:52:28Z,Rust,,Th0rgal,User,"ai-agents, autonomous-agents, claude, claude-code, coding-assistant, containerization, developer-tools, llm, mcp, opencode, orchestration, self-hosted, workspace-isoaltion",https://github.com/Th0rgal/sandboxed.sh,LLM skills
aj-geddes/claude-code-bmad-skills,"BMAD Method skills for Claude Code - Auto-detection, Memory integration, Slash commands. Transform Claude Code into a BMAD-powered development environment.",392,66,2,2025-10-25T08:57:40Z,2026-04-21T17:20:14Z,Shell,Other,aj-geddes,User,"agentic-ai, agile, ai-development, bmad, bmad-method, claude-code, development-tools, llm, skills",https://github.com/aj-geddes/claude-code-bmad-skills,LLM skills
swarmclawai/swarmclaw,"Self-hosted multi-agent AI runtime with MCP server support. Build, orchestrate, and run autonomous agents with memory, skills, schedules, and 23+ LLM providers (Claude, GPT, Gemini, OpenRouter, Ollama).",386,69,1,2026-02-18T22:21:42Z,2026-04-23T00:39:46Z,TypeScript,MIT License,swarmclawai,Organization,"agent-framework, agents, ai, ai-agents, autonomous-agents, claude, hermes, hermes-agent, llm, mcp, mcp-server, multi-agent, ollama, openclaw, openclaw-dashboard, openclaw-gateway, orchestration, orchestration-platform, self-hosted, typescript",https://github.com/swarmclawai/swarmclaw,LLM skills
lewislulu/llm-wiki-skill,Karpathy-style LLM knowledge base Agent Skill for OpenClaw/Codex. Experimental — will iterate over time.,384,73,1,2026-04-05T11:10:04Z,2026-04-22T14:49:49Z,TypeScript,,lewislulu,User,,https://github.com/lewislulu/llm-wiki-skill,LLM skills
zju-vipa/Odyssey,Odyssey: Empowering Minecraft Agents with Open-World Skills,377,23,1,2024-06-12T21:50:58Z,2026-04-15T01:52:21Z,Python,MIT License,zju-vipa,Organization,"agent, embodied-agent, fine-tuning, large-language-model, large-language-models, llm, llm-agent, minecraft",https://github.com/zju-vipa/Odyssey,LLM skills
opensolon/solon-ai,"Java AI application development framework (supports LLM-tool,skill; RAG; MCP; Agent-ReAct,Team-Agent). Compatible with java8 ~ java25. It can also be embedded in SpringBoot, jFinal, Vert.x, Quarkus, and other frameworks.",362,54,6,2025-03-04T23:42:44Z,2026-04-22T15:12:51Z,Java,Apache License 2.0,opensolon,Organization,"ai, chat, deepseek, embedding, function-call, java, llm, mcp-client, mcp-server, modelcontextprotocol, openai, rag, reranking, skills, tool-call",https://github.com/opensolon/solon-ai,LLM skills
boltmcp/boltmcp,,345,43,1,2025-03-27T14:40:31Z,2026-04-19T09:31:34Z,Shell,,boltmcp,Organization,"agentic-ai, llm, mcp, mcp-server, skills",https://github.com/boltmcp/boltmcp,LLM skills
astronomer/agents,AI agent tooling for data engineering workflows.,337,42,17,2026-01-13T16:23:31Z,2026-04-22T23:54:14Z,Python,Apache License 2.0,astronomer,Organization,"agentic-workflow, agents, ai, ai-agents, airflow, apache-airflow, claude, cursor, dag, data-engineering, data-pipelines, dbt, llm, mcp, orchestrator, skills, workflow-automation, workflow-management, workflow-orchestration, workflows",https://github.com/astronomer/agents,LLM skills
Affitor/affiliate-skills,"50 AI agent skills for affiliate marketing. Research trending content, write data-backed posts, generate infographics, build landing pages, deploy — full flywheel with social intelligence. Works with Claude Code, Pi, ChatGPT, Gemini, Cursor, Windsurf, any AI.",337,134,0,2026-03-15T20:51:26Z,2026-04-22T22:52:24Z,HTML,MIT License,Affitor,Organization,"affiliate-marketing, agent-skills, ai, ai-agents, chatgpt, claude, claude-code, content-marketing, cursor, gemini, influencer, llm, marketing, open-source, saas, seo, skill-md, social-media, tiktok, youtube",https://github.com/Affitor/affiliate-skills,LLM skills
Castor6/tactus,"The first browser AI Agent extension to support Agent Skills, enabling AI to perform complex tasks through an expandable skill system. 🌟 Star if you like it! | 首个支持 Agent Skills 的浏览器 AI Agent 扩展，让 AI 通过可扩展技能系统执行复杂任务 🌟 如果喜欢请点个 Star！",317,24,1,2026-01-23T09:41:41Z,2026-04-22T16:18:05Z,TypeScript,Apache License 2.0,Castor6,User,"ai, ai-agent, browser-extension, chat, chatbot, llm, skills",https://github.com/Castor6/tactus,LLM skills
geekjourneyx/jina-cli,"A lightweight CLI tool wrapping Jina AI Reader API for AI Agents. Fetch and parse any URL into LLM-friendly   formats (Markdown/Text/HTML). Perfect for reading X(Twitter), blogs, and news sites.",287,27,2,2026-02-28T08:39:26Z,2026-04-22T22:58:27Z,Go,MIT License,geekjourneyx,User,"ai-agent, ai-tools, claude-code, cli, jina-ai-reader, openclaw, skills, url-to-markdown",https://github.com/geekjourneyx/jina-cli,LLM skills
